k,num_removed_kmers,candidate_paper_title,candidate_dblp_id,citeseer_id,cluster_id,ratio,hashmap_build_time,match,average_query_time_phase1,average_query_time_phase2,average_query_time_total,levenshteinThreshold,ratioThreshold
7,5000,On the Use of Optimization for Data Mining: Theoretical Interactions and eCRM Opportunities,journals/mansci/PadmanabhanT03,10.1.1.332.1460,22104063,"(44, '-', 14)",95400.33915233612,Match,0.017916202545166016,0.009436368942260742,0.027843952178955078,0.4,0.85
7,5000,Market Segmentation and Product Technology Selection for Remanufacturable Products,journals/mansci/DeboTW05,10.1.1.8.9705,8754067,"(37, '-', 10)",95400.33915233612,Match,0.007691860198974609,0.0049076080322265625,0.012886524200439453,0.4,0.85
7,5000,© 2013 INFORMS How Costly Is Diversity? Affirmative Action in Light of Gender Differences in Competitiveness,journals/mansci/NiederleSV13,10.1.1.353.5538,23351374,"(58, '-', 22)",95400.33915233612,Match,0.010093212127685547,0.0068204402923583984,0.017315149307250977,0.4,0.85
7,5000,Risk Aversion in Cumulative Prospect Theory,journals/mansci/SchmidtZ08,10.1.1.200.8975,12454542,"(28, '-', 28)",95400.33915233612,Match,0.005731821060180664,0.003384113311767578,0.009330987930297852,0.4,0.85
7,5000,Market for Software Vulnerabilities? Think Again,journals/mansci/KannanT05,10.1.1.165.5215,6254115,"(32, '-', 19)",95400.33915233612,Match,0.004506826400756836,0.0023441314697265625,0.006993770599365234,0.4,0.85
7,5000,Modeling Daily Arrivals to a Telephone Call Center,journals/mansci/AvramidisDL04,10.1.1.13.358,8612117,"(40, '-', 15)",95400.33915233612,Match,0.002228260040283203,0.0013544559478759766,0.003664731979370117,0.4,0.85
7,5000,Monopoly Pricing in the Presence of Social Learning,journals/mansci/CrapisIMS17,10.1.1.211.1652,13306007,"(27, '-', 27)",95400.33915233612,Match,0.008704900741577148,0.005235910415649414,0.014225244522094727,0.4,0.85
7,5000,Ethnic Innovation and U.S. Multinational Firm Activity,journals/mansci/FoleyK13,10.1.1.361.36,24107414,"(34, '-', 34)",95400.33915233612,Match,0.005210399627685547,0.0028100013732910156,0.008197784423828125,0.4,0.85
7,5000,Structuring The New Product Development Pipeline,journals/mansci/DingE02,10.1.1.37.4575,2809236,"(21, '-', 13)",95400.33915233612,Match,0.0058498382568359375,0.004229307174682617,0.01030731201171875,0.4,0.85
7,5000,Privacy Regulation and Online Advertising,journals/mansci/GoldfarbT11,10.1.1.175.6607,11183943,"(22, '-', 12)",95400.33915233612,Match,0.003731250762939453,0.002362489700317383,0.0062448978424072266,0.4,0.85
7,5000,Cooperation in Games with Forgetfulness,journals/mansci/ThomadsenB11,10.1.1.145.8550,10338895,"(21, '-', 11)",95400.33915233612,Match,0.002480030059814453,0.001943826675415039,0.004524946212768555,0.4,0.85
7,5000,Sensitivity to Distance and Baseline Distributions in Forecast Evaluation,journals/mansci/JoseNW09,10.1.1.163.4935,9710357,"(35, '-', 11)",95400.33915233612,Match,0.006331920623779297,0.0049304962158203125,0.01151132583618164,0.4,0.85
7,5000,A Generalization of Pratt-Arrow Measure to Non-Expected-Utility Preferences and Inseparable Probability and Utility,journals/mansci/Nau03,10.1.1.12.7921,1377060,"(67, '-', 67)",95400.33915233612,Match,0.015241861343383789,0.012489557266235352,0.028341054916381836,0.4,0.85
7,5000,©2007 INFORMS Bias and Variance Approximation in Value Function Estimates,journals/mansci/MannorSST07,10.1.1.163.4961,10453277,"(30, '-', 23)",95400.33915233612,Match,0.009269475936889648,0.006922483444213867,0.016575098037719727,0.4,0.85
7,5000,Consumer Privacy and Marketing Avoidance: A Static Model,journals/mansci/HannHLP08,10.1.1.119.4332,6353346,"(44, '-', 44)",95400.33915233612,Match,0.011703252792358398,0.0077168941497802734,0.019840002059936523,0.4,0.85
7,5000,Competition and Outsourcing with Scale Economies,journals/mansci/CachonH02,10.1.1.8.7587,3939162,"(28, '-', 14)",95400.33915233612,Match,0.006557464599609375,0.004590034484863281,0.011398077011108398,0.4,0.85
7,5000,The Effect of Incentive Schemes and Organizational Arrangements on the New Product Development Process,journals/mansci/NatterMFDT01,10.1.1.29.4012,4688493,"(51, '-', 16)",95400.33915233612,Match,0.014684915542602539,0.010129451751708984,0.025368213653564453,0.4,0.85
7,5000,Joint Inventory Replenishment and Component Allocation Optimization in an Assemble-to-Order System,journals/mansci/AkcayX04,10.1.1.333.5019,7267011,"(57, '-', 17)",95400.33915233612,Match,0.009325265884399414,0.006189823150634766,0.015900611877441406,0.4,0.85
7,5000,Queuing for Expert Services,journals/mansci/DeboTW08,10.1.1.196.5699,12396638,"(16, '-', 8)",95400.33915233612,Match,0.003922700881958008,0.003385782241821289,0.0074689388275146484,0.4,0.85
7,5000,IQ and Mutual Fund Choice *,journals/mansci/GrinblattIKK16,10.1.1.352.2239,23276403,"(19, '-', 17)",95400.33915233612,Match,0.0029828548431396484,0.0019655227661132812,0.0050776004791259766,0.4,0.85
7,5000,Non-Linear Pricing of Information Goods,journals/mansci/Sundararajan04,10.1.1.18.9232,523246,"(18, '-', 10)",95400.33915233612,Match,0.005689382553100586,0.00377655029296875,0.009659767150878906,0.4,0.85
7,5000,A Fast Cross-Entropy Method for Estimating Buffer Overflows in Queueing Networks,journals/mansci/BoerKR04,10.1.1.399.6839,1055783,"(57, '-', 57)",95400.33915233612,Match,0.00948953628540039,0.006645917892456055,0.01645636558532715,0.4,0.85
7,5000,The ‘I Designed It Myself’ effect in mass customization,journals/mansci/FrankeSK10,10.1.1.334.1131,13833651,"(20, '-', 14)",95400.33915233612,Match,0.003770589828491211,0.002294301986694336,0.006200313568115234,0.4,0.85
7,5000,Service Level Differentiation in Call Centers with Fully Flexible Servers,journals/mansci/GurvichAM08,10.1.1.363.505,4779436,"(36, '-', 14)",95400.33915233612,Match,0.006376028060913086,0.005783796310424805,0.012446165084838867,0.4,0.85
7,5000,© 2008 INFORMS Sequential Testing of Product Designs: Implications for Learning,journals/mansci/EratK08,10.1.1.226.1534,14046686,"(27, '-', 9)",95400.33915233612,Match,0.0066335201263427734,0.004622936248779297,0.011526823043823242,0.4,0.85
7,5000,Eliminating Public Knowledge Biases in Information Aggregation Mechanisms,journals/mansci/ChenFH04,10.1.1.1.8862,8932723,"(33, '-', 40)",95400.33915233612,Match,0.011765003204345703,0.009575366973876953,0.021808624267578125,0.4,0.85
7,5000,Inventory Record Inaccuracy: An Empirical Analysis,journals/mansci/DeHoratiusR08,10.1.1.105.496,849610,"(34, '-', 10)",95400.33915233612,Match,0.007831811904907227,0.00487065315246582,0.01296544075012207,0.4,0.85
7,5000,Is IT Access Enough? Evidence from a Natural Experiment in India’s Agriculture Markets,journals/mansci/ParkerRS16,10.1.1.224.9048,13969567,"(38, '-', 38)",95400.33915233612,Match,0.009559392929077148,0.0062334537506103516,0.01608586311340332,0.4,0.85
7,5000,Managing Demand and Sales Dynamics in New Product Diffusion Under Supply Constraint,journals/mansci/HoST02,10.1.1.8.3504,4551366,"(57, '-', 35)",95400.33915233612,Match,0.011782169342041016,0.009151935577392578,0.021419525146484375,0.4,0.85
7,5000,When Rational Sellers Face Non-Rational Buyers: Evidence from Herding on eBay,journals/mansci/SimonsohnA08,10.1.1.379.4953,7822933,"(48, '-', 42)",95400.33915233612,Match,0.005248546600341797,0.0035016536712646484,0.008968353271484375,0.4,0.85
7,5000,Who Should Be Responsible for Software Security? A Comparative Analysis of Liability Policies in Network Environments,journals/mansci/AugustT11,10.1.1.260.363,15298794,"(66, '-', 59)",95400.33915233612,Match,0.017615079879760742,0.012866973876953125,0.0311124324798584,0.4,0.85
7,5000,Choice-based Elicitation and Decomposition of Decision Weights for Gains and Losses under Uncertainty,journals/mansci/AbdellaouiVW05,10.1.1.200.3128,5662931,"(46, '-', 11)",95400.33915233612,Match,0.01056218147277832,0.008218526840209961,0.01925206184387207,0.4,0.85
7,5000,The Price of Anarchy in Supply Chains: Quantifying the Efficiency of Price-Only Contracts,journals/mansci/PerakisR07,10.1.1.145.8150,3889150,"(68, '-', 21)",95400.33915233612,Match,0.01740121841430664,0.01225423812866211,0.0302886962890625,0.4,0.85
7,5000,Do General Managerial Skills Spur Innovation? *,journals/mansci/CustodioFM19,10.1.1.400.7329,26779032,"(33, '-', 12)",95400.33915233612,Match,0.005522966384887695,0.0030639171600341797,0.008768796920776367,0.4,0.85
7,5000,© 2005 INFORMS Three New Tests of Independence That Differentiate Models of Risky Decision Making,journals/mansci/Birnbaum05,10.1.1.65.6349,3925148,"(50, '-', 43)",95400.33915233612,Match,0.00836491584777832,0.005190372467041016,0.013851404190063477,0.4,0.85
7,5000,Screening Peers Softly: Inferring the Quality of Small Borrowers,journals/mansci/IyerKLS16,10.1.1.414.730,27712487,"(47, '-', 9)",95400.33915233612,Match,0.006058692932128906,0.002962350845336914,0.009194135665893555,0.4,0.85
7,5000, Revenue Management with Limited Demand Information,journals/mansci/LanGBK08,10.1.1.151.4931,9342884,"(28, '-', 10)",95400.33915233612,Match,0.00856328010559082,0.004487037658691406,0.013315200805664062,0.4,0.85
7,5000,Weak-Form and Semi-Strong-Form Stock Return Predictability Revisited,journals/mansci/FersonHS05,10.1.1.409.8577,27388411,"(55, '-', 33)",95400.33915233612,Match,0.007693052291870117,0.0043332576751708984,0.012288331985473633,0.4,0.85
7,5000,“Nursevendor Problem”: Personnel Staffing in the Presence of Endogenous Absenteeism,journals/mansci/GreenSS13,10.1.1.172.5787,10933099,"(53, '-', 53)",95400.33915233612,Match,0.007348775863647461,0.0036132335662841797,0.011179208755493164,0.4,0.85
7,5000,Market Valuation and Employee Stock Options,journals/mansci/Zhang06,10.1.1.199.7161,12652229,"(28, '-', 17)",95400.33915233612,Match,0.004404306411743164,0.0027306079864501953,0.007299184799194336,0.4,0.85
7,5000,Auctioning Supply Contracts,journals/mansci/Chen07,10.1.1.195.1465,11703511,"(16, '-', 16)",95400.33915233612,Match,0.005115032196044922,0.003446817398071289,0.00877690315246582,0.4,0.85
7,5000,The Impact of Founder Professional Education Background on the Adoption of Open Science by For-Profit Biotechnology Firms,journals/mansci/Ding11,10.1.1.379.816,25253024,"(69, '-', 14)",95400.33915233612,Match,0.013048171997070312,0.00944662094116211,0.022952556610107422,0.4,0.85
7,5000,On the Depth and Dynamics of Online Search Behavior 1,journals/mansci/JohnsonMFBL04,10.1.1.195.5880,12314937,"(27, '-', 13)",95400.33915233612,Match,0.004914283752441406,0.0031642913818359375,0.008266687393188477,0.4,0.85
7,5000, Quality Disclosure Formats in a Distribution Channel,journals/mansci/Guo09,10.1.1.381.9044,13951045,"(32, '-', 24)",95400.33915233612,Match,0.007494926452636719,0.00498509407043457,0.012758016586303711,0.4,0.85
7,5000,Efficient Diversification According to Stochastic Dominance Criteria,journals/mansci/Kuosmanen04,10.1.1.318.9587,5914221,"(44, '-', 13)",95400.33915233612,Match,0.008983850479125977,0.006695270538330078,0.015999794006347656,0.4,0.85
7,5000,A Forward Monte Carlo Method for Solving Influence Diagrams Using Local Computation,journals/mansci/CharnesS04,10.1.1.23.1905,2053708,"(44, '-', 42)",95400.33915233612,Match,0.01690363883972168,0.009304046630859375,0.02672433853149414,0.4,0.85
7,5000,Optimal Auditing with Scoring Theory and Application to Insurance Fraud,journals/mansci/DionneGP09,10.1.1.372.309,24825779,"(33, '-', 12)",95400.33915233612,Match,0.007865667343139648,0.00516510009765625,0.013321876525878906,0.4,0.85
7,5000,Ambiguity Aversion and the Preference for Established Brands,journals/mansci/MuthukrishnanWX09,10.1.1.410.3593,19977531,"(35, '-', 13)",95400.33915233612,Match,0.007889032363891602,0.00499272346496582,0.01317453384399414,0.4,0.85
7,5000,Psychological pressure in competitive environments: New evidence from randomized natural experiments *,journals/mansci/KocherLS12,10.1.1.231.7271,14317855,"(20, '-', 35)",95400.33915233612,Match,0.016961097717285156,0.010894298553466797,0.02836894989013672,0.4,0.85
7,5000,Diasporas and Outsourcing: Evidence from oDesk and India,journals/mansci/GhaniKS14,10.1.1.363.1195,24268915,"(39, '-', 12)",95400.33915233612,Match,0.0044231414794921875,0.002961397171020508,0.007567644119262695,0.4,0.85
7,5000,© 2006 INFORMS Introduction of New Technologies to Competing Industrial Customers,journals/mansci/EratK06,10.1.1.167.7397,10668354,"(33, '-', 9)",95400.33915233612,Match,0.008212566375732422,0.005817413330078125,0.014343738555908203,0.4,0.85
7,5000,© 2010 INFORMS Capturing Consumption Flexibility in Assortment Choice from Scanner Panel Data,journals/mansci/Guo10,10.1.1.381.7543,25402535,"(58, '-', 15)",95400.33915233612,Match,0.009853839874267578,0.0064373016357421875,0.01667499542236328,0.4,0.85
7,5000,Investor Flows and the 2008 Boom/Bust in Oil Prices.” Working paper,journals/mansci/Singleton14,10.1.1.378.8300,13945057,"(42, '-', 8)",95400.33915233612,Match,0.0033473968505859375,0.0019960403442382812,0.0054776668548583984,0.4,0.85
7,5000,Can Losing Lead to Winning?,journals/mansci/BergerP11,10.1.1.169.6364,10785669,"(21, '-', 21)",95400.33915233612,Match,0.0008893013000488281,0.00047278404235839844,0.0014009475708007812,0.4,0.85
7,5000,How much did the Liberty shipbuilders forget,journals/mansci/Thompson07,10.1.1.98.2440,5180655,"(15, '-', 32)",95400.33915233612,Match,0.002131223678588867,0.0018165111541748047,0.004044294357299805,0.4,0.85
7,5000,Analysis and Optimization of a Multi-Stage Inventory-Queue System,journals/mansci/LiuLY04,10.1.1.12.4729,1352933,"(28, '-', 15)",95400.33915233612,Match,0.00867319107055664,0.005716562271118164,0.014684677124023438,0.4,0.85
7,5000,© 2004 INFORMS Two Faces: Effects of Business Groups on Innovation in Emerging Economies,journals/mansci/MahmoodM04,10.1.1.159.2058,10261630,"(47, '-', 13)",95400.33915233612,Match,0.010062456130981445,0.006192922592163086,0.016605377197265625,0.4,0.85
7,5000,The Assortment Packing Problem: Multiperiod Assortment Planning for Short-Lived Products,journals/mansci/CaroMR14,10.1.1.367.6864,24550275,"(79, '-', 16)",95400.33915233612,Match,0.008355379104614258,0.006185293197631836,0.014855384826660156,0.4,0.85
7,5000,Yield Optimization of Display Advertising with Ad Exchange,journals/mansci/BalseiroFMM14,10.1.1.208.7815,13221585,"(32, '-', 15)",95400.33915233612,Match,0.006164073944091797,0.003914833068847656,0.010311126708984375,0.4,0.85
7,5000,Information System Success: Individual and Organizational Determinants 1 by,journals/mansci/SabherwalJC06,10.1.1.93.914,5262629,"(33, '-', 14)",95400.33915233612,Match,0.009271383285522461,0.005990505218505859,0.015612125396728516,0.4,0.85
7,5000,Bertrand Supertraps,journals/mansci/CabralV05,10.1.1.196.7354,12410773,"(13, '-', 13)",95400.33915233612,Match,0.001094818115234375,0.0006511211395263672,0.0017898082733154297,0.4,0.85
7,5000,Financial Integration and Liquidity Crises,journals/mansci/CastiglionesiFL19,10.1.1.352.6497,23299035,"(20, '-', 20)",95400.33915233612,Match,0.005532979965209961,0.003568410873413086,0.009320735931396484,0.4,0.85
7,5000,Efficient Risk Estimation via Nested Sequential Simulation,journals/mansci/BroadieDM11,10.1.1.163.6063,10460973,"(31, '-', 31)",95400.33915233612,Match,0.006600856781005859,0.0032236576080322266,0.010040283203125,0.4,0.85
7,5000,Link to Success: How Blogs Build an Audience by Promoting Rivals,journals/mansci/MayzlinY12,10.1.1.221.1861,13805047,"(58, '-', 10)",95400.33915233612,Match,0.0045278072357177734,0.0027103424072265625,0.007399559020996094,0.4,0.85
7,5000,Structural Estimation of Callers ’ Delay Sensitivity in Call Centers,journals/mansci/AksinAES13,10.1.1.413.2159,27630450,"(30, '-', 9)",95400.33915233612,Match,0.006273031234741211,0.005812883377075195,0.012386798858642578,0.4,0.85
7,5000,A Heuristic for Generating Scenario Trees for Multistage Decision Problems,journals/mansci/HoylandW01,10.1.1.15.8912,8481990,"(30, '-', 14)",95400.33915233612,Match,0.007051229476928711,0.004092216491699219,0.011391401290893555,0.4,0.85
7,5000,Persistency Model and Its Applications in Choice Modeling ∗,journals/mansci/NatarajanST09,10.1.1.99.7629,5568318,"(27, '-', 9)",95400.33915233612,Match,0.011071920394897461,0.007030487060546875,0.018508195877075195,0.4,0.85
7,5000,Is Pay-for-Performance Detrimental to Innovation? ∗,journals/mansci/EdererM13,10.1.1.185.862,11705207,"(21, '-', 21)",95400.33915233612,Match,0.00617527961730957,0.0036208629608154297,0.010004281997680664,0.4,0.85
7,5000,Improving Supply Chain Performance and Managing Risk Under Weather-Related Demand Uncertainty,journals/mansci/ChenY10,10.1.1.375.6544,25013189,"(61, '-', 18)",95400.33915233612,Match,0.012883424758911133,0.009830474853515625,0.023220062255859375,0.4,0.85
7,5000,Pricing and Allocation for Quality Differentiated Online Services,journals/mansci/BapnaGG05,10.1.1.81.696,4638404,"(27, '-', 7)",95400.33915233612,Match,0.008974552154541016,0.006176471710205078,0.015520572662353516,0.4,0.85
7,5000,© 2005 INFORMS Information Sharing in a Supply Chain Under ARMA Demand,journals/mansci/GaurGS05,10.1.1.113.7628,5892049,"(36, '-', 18)",95400.33915233612,Match,0.0071828365325927734,0.004811525344848633,0.012289285659790039,0.4,0.85
7,5000,Investment Under Uncertainty in Information Technology: Acquisition and Development Projects,journals/mansci/SchwartzZ03,10.1.1.321.3148,20932560,"(40, '-', 27)",95400.33915233612,Match,0.013364315032958984,0.009077787399291992,0.022923707962036133,0.4,0.85
7,5000,  A Bayesian Model for Prelaunch Sales Forecasting of Recorded Music,journals/mansci/LeeBK03,10.1.1.80.3242,4588508,"(44, '-', 12)",95400.33915233612,Match,0.0077152252197265625,0.004956483840942383,0.012964248657226562,0.4,0.85
7,5000,Conscience Accounting: Emotional Dynamics and Social Behavior,journals/mansci/GneezyIM14,10.1.1.368.7210,24623246,"(31, '-', 12)",95400.33915233612,Match,0.008465766906738281,0.005629777908325195,0.014380216598510742,0.4,0.85
7,5000,Decentralized Supply Chains with Competing Retailers under Demand Uncertainty,journals/mansci/BernsteinF05,10.1.1.198.1317,4164614,"(49, '-', 20)",95400.33915233612,Match,0.012270212173461914,0.008496284484863281,0.021181821823120117,0.4,0.85
7,5000, Real-Time Delay Estimation in Overloaded Multiserver Queues with Abandonments,journals/mansci/IbrahimW09,10.1.1.147.6232,7853634,"(51, '-', 51)",95400.33915233612,Match,0.005533933639526367,0.0038285255432128906,0.009592294692993164,0.4,0.85
7,5000, A Constant Approximation Algorithm for the One-Warehouse Multi-Retailer Problem,journals/mansci/LeviRSS08,10.1.1.134.9472,5030333,"(34, '-', 11)",95400.33915233612,Match,0.006634712219238281,0.0036618709564208984,0.010539531707763672,0.4,0.85
7,5000, The Diseconomies of Queue Pooling in a Discretionary Task Setting: An Empirical Investigation of Emergency Department Length of Stay,journals/mansci/SongTM15,10.1.1.367.9354,25096286,"(68, '-', 26)",95400.33915233612,Match,0.015720367431640625,0.010232210159301758,0.026454925537109375,0.4,0.85
7,5000,Demand Forecasting Behavior: System Neglect and Change Detection,journals/mansci/KremerMS11,10.1.1.404.2058,19828758,"(42, '-', 14)",95400.33915233612,Match,0.009082555770874023,0.0057544708251953125,0.01516866683959961,0.4,0.85
7,5000,The Value of Commitments When Selling to Strategic Consumers: A Supply Chain Perspective,journals/mansci/KabulP19,10.1.1.305.1922,19866126,"(66, '-', 18)",95400.33915233612,Match,0.012629270553588867,0.0086669921875,0.021746397018432617,0.4,0.85
7,5000,Information Aggregation and Allocative Efficiency in Smooth Markets,journals/mansci/IyerJM14,10.1.1.175.6933,11186248,"(33, '-', 9)",95400.33915233612,Match,0.009373188018798828,0.0075266361236572266,0.017287254333496094,0.4,0.85
7,5000,A Non-parametric Approach to Modeling Choice with Limited Data,journals/mansci/FariasJS13,10.1.1.187.3223,14139459,"(29, '-', 29)",95400.33915233612,Match,0.009586334228515625,0.00648188591003418,0.01642012596130371,0.4,0.85
7,5000,ASingle-Product Inventory Model for Multiple Demand Classes,journals/mansci/ArslanGR07,10.1.1.227.1469,14101969,"(36, '-', 15)",95400.33915233612,Match,0.008111238479614258,0.006174564361572266,0.014579534530639648,0.4,0.85
7,5000,Computing Power Indices for Large Voting Games,journals/mansci/Leech03,10.1.1.11.3531,5671571,"(30, '-', 12)",95400.33915233612,Match,0.0062062740325927734,0.004060983657836914,0.010486841201782227,0.4,0.85
7,5000,  A No-Arbitrage Analysis of Macroeconomic Determinants of the Credit Spread Term Structure,journals/mansci/WuZ08,10.1.1.156.6453,10166609,"(59, '-', 23)",95400.33915233612,Match,0.013699054718017578,0.008968830108642578,0.023126602172851562,0.4,0.85
7,5000,New Investors and Bubbles: An Analysis of the Baosteel Call Warrant Bubble,journals/mansci/GongPS17,10.1.1.388.1964,25836718,"(55, '-', 10)",95400.33915233612,Match,0.006968498229980469,0.006260395050048828,0.013535022735595703,0.4,0.85
7,5000,© 2013 INFORMS Guilt by Association: Strategic Failure Prevention and Recovery Capacity Investments,journals/mansci/KimT13,10.1.1.360.8611,24091983,"(49, '-', 11)",95400.33915233612,Match,0.011691808700561523,0.006990671157836914,0.019049882888793945,0.4,0.85
7,5000,Imprecise Datasets as a Source of Ambiguity: A Model and Experimental Evidence Evidence,journals/mansci/AradG12,10.1.1.408.9441,27340735,"(49, '-', 18)",95400.33915233612,Match,0.01290440559387207,0.009222030639648438,0.022605419158935547,0.4,0.85
7,5000,A Corporate Beauty Contest,journals/mansci/GrahamHP17,10.1.1.165.6664,10588206,"(18, '-', 10)",95400.33915233612,Match,0.002332448959350586,0.0021016597747802734,0.004540920257568359,0.4,0.85
7,5000,The Value of Partial Resource Pooling: Should a Service Network Be Integrated or Product-Focused,journals/mansci/AtaM09,10.1.1.296.1214,9713024,"(66, '-', 15)",95400.33915233612,Match,0.008045434951782227,0.006220817565917969,0.014583110809326172,0.4,0.85
7,5000,A Structural Model of Employee Behavioral Dynamics in Enterprise Social Media,journals/mansci/HuangSG15,10.1.1.219.6074,13719515,"(44, '-', 44)",95400.33915233612,Match,0.011345148086547852,0.00823664665222168,0.020003080368041992,0.4,0.85
7,5000,Pricing American-Style Derivatives with European Call Options,journals/mansci/LapriseFMLZ06,10.1.1.362.4258,438655,"(44, '-', 44)",95400.33915233612,Match,0.007646799087524414,0.003905773162841797,0.011783361434936523,0.4,0.85
7,5000,Dividend Growth Predictability and the Price-Dividend Ratio ∗,journals/mansci/PiattiT20,10.1.1.295.2033,19274473,"(43, '-', 12)",95400.33915233612,Match,0.003213167190551758,0.0021905899047851562,0.005528450012207031,0.4,0.85
7,5000,An Experimental Study of Information Revelation Policies in Sequential Auctions,journals/mansci/CasonKS11,10.1.1.189.893,12120082,"(35, '-', 16)",95400.33915233612,Match,0.011785745620727539,0.007711648941040039,0.019910335540771484,0.4,0.85
7,5000,© 2004 INFORMS Innovation and Attention to Detail in the Quality Improvement Paradigm,journals/mansci/NavehE04,10.1.1.375.2643,24984128,"(40, '-', 13)",95400.33915233612,Match,0.011568307876586914,0.006780862808227539,0.018779754638671875,0.4,0.85
7,5000,Valuing Internal vs. External Knowledge: Explaining the Preference for Outsiders,journals/mansci/MenonP03,10.1.1.199.837,5222950,"(50, '-', 10)",95400.33915233612,Match,0.010629415512084961,0.007953166961669922,0.01898670196533203,0.4,0.85
7,5000,A Contract and Balancing Mechanism for Sharing Capacity in a Communication Network,journals/mansci/AndersonKS06,10.1.1.18.9561,850411,"(45, '-', 45)",95400.33915233612,Match,0.016896486282348633,0.012240409851074219,0.02973341941833496,0.4,0.85
7,5000,When Kerry Met Sally: Politics and Perceptions in the Demand for Movies,journals/mansci/RoosS14,10.1.1.190.4809,13080802,"(43, '-', 10)",95400.33915233612,Match,0.005361318588256836,0.0041234493255615234,0.009679317474365234,0.4,0.85
7,5000,Compensation and Peer Effects in Competing Sales Teams,journals/mansci/ChanLP14,10.1.1.154.1293,10953867,"(31, '-', 12)",95400.33915233612,Match,0.00627589225769043,0.003744363784790039,0.010222911834716797,0.4,0.85
7,5000,Managing Disruption Risk: The Interplay Between Operations and Insurance,journals/mansci/DongT12,10.1.1.208.1104,13182707,"(44, '-', 12)",95400.33915233612,Match,0.007077693939208984,0.004993915557861328,0.012314319610595703,0.4,0.85
7,5000,Solving Project Scheduling Problems by Minimum Cut Computations,journals/mansci/MohringSSU03,10.1.1.34.5710,2690748,"(29, '-', 29)",95400.33915233612,Match,0.005031585693359375,0.0037384033203125,0.009005546569824219,0.4,0.85
7,5000,Preference Reversals to Explain Ambiguity Aversion,journals/mansci/TrautmannVW11,10.1.1.322.705,21042119,"(23, '-', 14)",95400.33915233612,Match,0.0052490234375,0.0036802291870117188,0.009137868881225586,0.4,0.85
7,5000,Responding to Unexpected Overloads in Large-Scale Service Systems,journals/mansci/PerryW09,10.1.1.147.6570,9451539,"(45, '-', 45)",95400.33915233612,Match,0.010014533996582031,0.00524139404296875,0.015552520751953125,0.4,0.85
7,5000,A Heuristic for Generating Scenario Trees for Multistage Decision Problems,journals/mansci/Klaassen02,10.1.1.15.8912,8481990,"(30, '-', 14)",95400.33915233612,Match,0.009047508239746094,0.006145000457763672,0.015500783920288086,0.4,0.85
7,5000,Sunk Cost Fallacy in Driving the World’s Costliest Cars,journals/mansci/HoPR18,10.1.1.307.4053,19961765,"(39, '-', 39)",95400.33915233612,Match,0.004899740219116211,0.0026357173919677734,0.007688999176025391,0.4,0.85
7,5000,Private Equity and Industry Performance,journals/mansci/BernsteinLSS17,10.1.1.167.3568,10633630,"(21, '-', 21)",95400.33915233612,Match,0.0048122406005859375,0.0032303333282470703,0.008230209350585938,0.4,0.85
7,5000,Optimal Multi-Period Pricing with Service Guarantees,journals/mansci/BorgsCCLN14,10.1.1.306.9357,19937885,"(29, '-', 10)",95400.33915233612,Match,0.007190704345703125,0.0034008026123046875,0.010799169540405273,0.4,0.85
