k,num_removed_kmers,candidate_paper_title,candidate_mag_id,candidate_dblp_id,ratio,hashmap_build_time,match,average_query_time_phase1,average_query_time_phase2,average_query_time_total,levenshteinThreshold,ratioThreshold
6,3000,A note on the undercut procedure.,2262507881,journals/corr/Aziz13,"(21, '-', 21)",129762.29471158981,Match,0.0071773529052734375,0.008795738220214844,0.01631450653076172,0.4,0.85
6,3000,Asymptotic analysis of downlink MISO systems over Rician fading channels.,2262533564,conf/icassp/FalconetSKD16,"(35, '-', 21)",129762.29471158981,Match,0.016176223754882812,0.022024869918823242,0.03903627395629883,0.4,0.85
6,3000,Spread spectrum communications.,2837340261,journals/jasis/Sharma86,"(14, '-', 14)",129762.29471158981,Match,0.014946699142456055,0.017554759979248047,0.03317427635192871,0.4,0.85
6,3000,A Note on the Complexity of Computing the Number of Reachable Vertices in a Digraph.,2262622716,journals/corr/Borassi16,"(16, '-', 36)",129762.29471158981,Match,0.0280759334564209,0.04118466377258301,0.0707406997680664,0.4,0.85
6,3000,Erratum to: Surgical robotics beyond enhanced dexterity instrumentation: a survey of machine learning techniques and their role in intelligent and autonomous surgical actions.,2262715205,journals/cars/KassahunYTSGMP16a,"(107, '-', 19)",129762.29471158981,Match,0.0556492805480957,0.06366991996765137,0.1216886043548584,0.4,0.85
6,3000,Correction to: Exposing the probabilistic causal structure of discrimination.,2262800383,journals/ijdsa/BonchiHMR20,"(34, '-', 14)",129762.29471158981,Match,0.026512861251831055,0.03395867347717285,0.06170797348022461,0.4,0.85
6,3000,A Bayesian approach for initialization of weights in backpropagation neural net with application to character recognition.,2262905421,journals/corr/abs-2004-01875,"(62, '-', 15)",129762.29471158981,Match,0.0335850715637207,0.0408174991607666,0.0759272575378418,0.4,0.85
6,3000,Learning in the information society.,2262932382,journals/itse/IsaiasM06,"(12, '-', 11)",129762.29471158981,Match,0.008246421813964844,0.01564955711364746,0.024501562118530273,0.4,0.85
6,3000,Typical sumsets of linear codes.,2263085999,conf/allerton/ZhuG16,"(22, '-', 11)",129762.29471158981,Match,0.006583213806152344,0.011607646942138672,0.01865983009338379,0.4,0.85
6,3000,Efficient image deployment in cloud environments.,2263092302,journals/jnca/GarciaF16,"(27, '-', 19)",129762.29471158981,Match,0.013370037078857422,0.011336326599121094,0.02521967887878418,0.4,0.85
6,3000,Interaction Profiles for an Artificial Conversational Companion.,2263133730,conf/companion/HohnSBZM15,"(15, '-', 16)",129762.29471158981,Match,0.03335404396057129,0.04184222221374512,0.07670998573303223,0.4,0.85
6,3000,Vector median-rational hybrid filters for multichannel image processing.,2263215021,conf/iscas/KhrijiG99,"(38, '-', 13)",129762.29471158981,Match,0.01998114585876465,0.027791976928710938,0.04880523681640625,0.4,0.85
6,3000,Acyclic edge colourings of graphs with large girth.,2263289706,journals/rsa/CaiPRW17,"(29, '-', 19)",129762.29471158981,Match,0.009860992431640625,0.015557050704956055,0.026017189025878906,0.4,0.85
6,3000,Optimal asymptotic bounds on the oracle use in computations from Chaitin's Omega.,2263327792,journals/corr/BarmpaliasLF16,"(42, '-', 15)",129762.29471158981,Match,0.018269062042236328,0.02604055404663086,0.04527473449707031,0.4,0.85
6,3000,Concavity of the Auxiliary Function for Classical-Quantum Channels.,2263335765,journals/tit/ChengH16,"(13, '-', 37)",129762.29471158981,Match,0.018996238708496094,0.0281522274017334,0.04819536209106445,0.4,0.85
6,3000,Note from the publisher.,2263358743,journals/program/Peters04,"(13, '-', 13)",129762.29471158981,Match,0.011005163192749023,0.01229715347290039,0.0237884521484375,0.4,0.85
6,3000,Approximation in mechanism design with interdependent values.,2263449327,conf/sigecom/Li13,"(28, '-', 10)",129762.29471158981,Match,0.007691144943237305,0.010385513305664062,0.01853656768798828,0.4,0.85
6,3000,On the capacity of free-space optical intensity channels.,2263466419,conf/isit/LapidothMW08,"(36, '-', 19)",129762.29471158981,Match,0.028872251510620117,0.03908729553222656,0.06949377059936523,0.4,0.85
6,3000,Letters to the editor.,2263486842,journals/lre/Roberson67,"(12, '-', 12)",129762.29471158981,Match,0.004880189895629883,0.008616447448730469,0.013837099075317383,0.4,0.85
6,3000,Game characterizations and lower cones in the Weihrauch degrees.,2263488171,journals/lmcs/NobregaP19,"(30, '-', 11)",129762.29471158981,Match,0.005712747573852539,0.008016586303710938,0.014091968536376953,0.4,0.85
6,3000,Nonexistence of two classes of generalized bent functions.,2263562934,journals/corr/LiD15b,"(34, '-', 19)",129762.29471158981,Match,0.015596151351928711,0.020815134048461914,0.03718829154968262,0.4,0.85
6,3000,Evaluating computational models of explanation using human judgments.,2263581552,conf/uai/PacerWCLG13,"(37, '-', 12)",129762.29471158981,Match,0.022571086883544922,0.03235769271850586,0.056116342544555664,0.4,0.85
6,3000,The Periodic Domino Problem Is Undecidable in the Hyperbolic Plane.,2263587161,conf/rp/Margenstern09,"(19, '-', 18)",129762.29471158981,Match,0.015576839447021484,0.025148868560791016,0.04168224334716797,0.4,0.85
6,3000,Clustering time series under the Fr&eacute;chet distance.,2263626696,conf/soda/DriemelKS16,"(23, '-', 20)",129762.29471158981,Match,0.012532711029052734,0.019449949264526367,0.03270888328552246,0.4,0.85
6,3000,"A note on ""An exact algorithm for the blocks relocation problem with new lower bounds"".",2837806110,journals/cor/Jin20,"(44, '-', 22)",129762.29471158981,Match,0.01630687713623047,0.02048015594482422,0.03762698173522949,0.4,0.85
6,3000,Spread spectrum communications.,2837808785,journals/jasis/Sharma86,"(14, '-', 14)",129762.29471158981,Match,0.010307550430297852,0.013298273086547852,0.024127483367919922,0.4,0.85
6,3000,Computational prediction and analysis of protein-protein interaction networks.,2263766110,journals/corr/abs-1709-01923,"(32, '-', 30)",129762.29471158981,Match,0.024195194244384766,0.030917882919311523,0.05625581741333008,0.4,0.85
6,3000,Mitteilungen der Schweizer Informatik Gesellschaft / 4_2016.,2263840420,journals/insk/X16k,"(24, '-', 24)",129762.29471158981,Match,0.0043332576751708984,0.006748676300048828,0.011370420455932617,0.4,0.85
6,3000,Asymptotic behavior of the node degrees in the ensemble average of adjacency matrix.,2263845688,journals/netsci/Hayashi16,"(64, '-', 17)",129762.29471158981,Match,0.028037548065185547,0.038278818130493164,0.0677027702331543,0.4,0.85
6,3000,An adaptive bilateral motion estimation algorithm and its hardware architecture.,2263874867,conf/vlsi/AkinCEKH10,"(46, '-', 20)",129762.29471158981,Match,0.034693241119384766,0.03831005096435547,0.07442069053649902,0.4,0.85
6,3000,Ecological theory provides insights about evolutionary computation.,2838189371,conf/gecco/DolsonO18,"(41, '-', 12)",129762.29471158981,Match,0.013740301132202148,0.0181429386138916,0.03260922431945801,0.4,0.85
6,3000,Photovoltaic power generation.,2838628149,journals/pieee/Schwartz93,"(17, '-', 18)",129762.29471158981,Match,0.006620883941650391,0.008756160736083984,0.015732288360595703,0.4,0.85
6,3000,Automatic gain control.,2838838400,conf/icassp/KangL84,"(9, '-', 9)",129762.29471158981,Match,0.0026464462280273438,0.005893707275390625,0.008779525756835938,0.4,0.85
6,3000,Mobile device security.,2838892220,conf/oopsla/Seacord15,"(13, '-', 13)",129762.29471158981,Match,0.007831811904907227,0.012731313705444336,0.02108144760131836,0.4,0.85
6,3000,Stability in p-th moment for multifactor uncertain differential equation.,2839105952,journals/jifs/MaLZ18,"(35, '-', 20)",129762.29471158981,Match,0.021209239959716797,0.027553319931030273,0.04981827735900879,0.4,0.85
6,3000,Symbolic path cost analysis for side-channel detection.,2839132370,conf/icse/BrennanSB18,"(25, '-', 10)",129762.29471158981,Match,0.009443283081054688,0.014501571655273438,0.024506330490112305,0.4,0.85
6,3000,Spread spectrum communications.,2839183881,journals/jasis/Sharma86,"(14, '-', 14)",129762.29471158981,Match,0.015191078186035156,0.017059326171875,0.03292679786682129,0.4,0.85
6,3000,Medical image processing.,2839720283,journals/isci/ChengW05,"(8, '-', 9)",129762.29471158981,Match,0.0037517547607421875,0.005257844924926758,0.009217500686645508,0.4,0.85
6,3000,An adaptive transversal filter VLSI.,2839721260,conf/icassp/KobayashiGAKUI86,"(18, '-', 9)",129762.29471158981,Match,0.009645700454711914,0.014937639236450195,0.025152921676635742,0.4,0.85
6,3000,Medical imaging systems.,2839785357,journals/pieee/King86,"(10, '-', 11)",129762.29471158981,Match,0.007995843887329102,0.009922981262207031,0.018326282501220703,0.4,0.85
6,3000,Photovoltaic power generation.,2840052186,journals/pieee/Schwartz93,"(17, '-', 18)",129762.29471158981,Match,0.0064046382904052734,0.008983373641967773,0.01573944091796875,0.4,0.85
6,3000,G protein-coupled receptor.,2840355405,journals/scholarpedia/Hille09,"(14, '-', 19)",129762.29471158981,Match,0.00925898551940918,0.011038780212402344,0.0207216739654541,0.4,0.85
6,3000,Introductory mathematical programming for EC.,2840617241,conf/gecco/Shir18,"(22, '-', 22)",129762.29471158981,Match,0.02131509780883789,0.027895450592041016,0.0502629280090332,0.4,0.85
6,3000,On the $k$-error linear complexity of binary sequences derived from polynomial quotients.,2282058484,journals/corr/ChenNW13,"(55, '-', 41)",129762.29471158981,Match,0.027382850646972656,0.035608530044555664,0.0642857551574707,0.4,0.85
6,3000,"Computational models for experiences in the arts, and multimedia.",2115940114,conf/mm/SridharanSR03,"(26, '-', 11)",129762.29471158981,Match,0.02847123146057129,0.037186384201049805,0.06704497337341309,0.4,0.85
6,3000,On Isomorphisms of Vertex-transitive Graphs.,2282061708,journals/combinatorics/ChenX16,"(13, '-', 15)",129762.29471158981,Match,0.014272928237915039,0.020696163177490234,0.035745859146118164,0.4,0.85
6,3000,Estimation of the number of signals in the presence of unknown correlated sensor noise.,2115943304,conf/icassp/Fuchs89,"(53, '-', 17)",129762.29471158981,Match,0.03787422180175781,0.049727439880371094,0.08942985534667969,0.4,0.85
6,3000,Greedy gossip with eavesdropping.,2049903316,conf/iswpc/UstebayCR08,"(25, '-', 13)",129762.29471158981,Match,0.003085613250732422,0.00511479377746582,0.008395195007324219,0.4,0.85
6,3000,Discretized Gabor Frames of Totally Positive Functions.,2115953426,journals/corr/BannertGS13,"(11, '-', 27)",129762.29471158981,Match,0.010531187057495117,0.01813793182373047,0.02937602996826172,0.4,0.85
6,3000,Denial-of-service in automation systems.,2115958140,conf/etfa/GranzerRK08,"(13, '-', 11)",129762.29471158981,Match,0.01822352409362793,0.02408766746520996,0.04323267936706543,0.4,0.85
6,3000,Linking spatial data: automated conversion of geo-information models and GML data to RDF.,2115959969,journals/ijsdir/BrinkJQS14,"(37, '-', 16)",129762.29471158981,Match,0.04098629951477051,0.05444622039794922,0.09746599197387695,0.4,0.85
6,3000,Preface to special issue: behavioural types.,2115962216,journals/mscs/GayR16a,"(29, '-', 17)",129762.29471158981,Match,0.014394760131835938,0.020142555236816406,0.0352940559387207,0.4,0.85
6,3000,Approximate range searching in higher dimension.,2115964316,conf/cccg/LiuCM04,"(28, '-', 12)",129762.29471158981,Match,0.011588811874389648,0.01869797706604004,0.031015872955322266,0.4,0.85
6,3000,Learning in the information society.,2049914329,journals/itse/IsaiasM06,"(12, '-', 11)",129762.29471158981,Match,0.008907079696655273,0.01604485511779785,0.0255889892578125,0.4,0.85
6,3000,Spread spectrum communications.,2815949414,journals/jasis/Sharma86,"(14, '-', 14)",129762.29471158981,Match,0.015523433685302734,0.017555952072143555,0.03375577926635742,0.4,0.85
6,3000,Single-source indexing.,2049919839,conf/sigdoc/Wright01,"(8, '-', 6)",129762.29471158981,Match,0.0036096572875976562,0.005805253982543945,0.009646415710449219,0.4,0.85
6,3000,Bayesian nonparametric comorbidity analysis of psychiatric disorders.,2115976142,journals/corr/RuizV0P14,"(47, '-', 21)",129762.29471158981,Match,0.012026548385620117,0.01640772819519043,0.029067039489746094,0.4,0.85
6,3000,Pipelined forwarding with energy balance in hexagonal wireless sensor networks.,2049921552,conf/icon/SheuS12,"(56, '-', 24)",129762.29471158981,Match,0.0329587459564209,0.0429682731628418,0.07755208015441895,0.4,0.85
6,3000,GenASiS Basics: Object-oriented utilitarian functionality for large-scale physics simulations.,2115983351,journals/corr/CardallB15,"(42, '-', 42)",129762.29471158981,Match,0.02842426300048828,0.03787684440612793,0.06769275665283203,0.4,0.85
6,3000,Battery state estimation using Unscented Kalman Filter.,2115984148,conf/icra/ZhangLF09,"(18, '-', 18)",129762.29471158981,Match,0.01349782943725586,0.01768350601196289,0.03186368942260742,0.4,0.85
6,3000,A robust packet scheduling algorithm for proportional delay differentiation services.,2115987344,conf/globecom/WeiXZ04,"(49, '-', 22)",129762.29471158981,Match,0.029317855834960938,0.03666996955871582,0.06735992431640625,0.4,0.85
6,3000,Data complexity measured by principal graphs.,2115990376,journals/cma/ZinovyevM13,"(29, '-', 12)",129762.29471158981,Match,0.014070510864257812,0.022786617279052734,0.03770613670349121,0.4,0.85
6,3000,An empirical analysis of training protocols for probabilistic gene finders.,2282099591,journals/bmcbi/MajorosS05,"(40, '-', 11)",129762.29471158981,Match,0.027879714965820312,0.036650657653808594,0.06585335731506348,0.4,0.85
6,3000,Congestion control for fair resource allocation in networks with multicast flows.,2115992973,conf/cdc/DebS01,"(45, '-', 14)",129762.29471158981,Match,0.028078794479370117,0.034430503845214844,0.06377720832824707,0.4,0.85
6,3000,Treewidth computation and extremal combinatorics.,2115994533,journals/combinatorica/FominV12,"(28, '-', 12)",129762.29471158981,Match,0.011028051376342773,0.01345682144165039,0.02510976791381836,0.4,0.85
6,3000,An improved Forward Algorithm for optimal control of a class of hybrid systems.,2116002998,conf/cdc/ZhangC01,"(29, '-', 17)",129762.29471158981,Match,0.021289825439453125,0.029860258102416992,0.0522761344909668,0.4,0.85
6,3000,Output feedback control of switched nonlinear systems using multiple Lyapunov functions.,2116007368,conf/amcc/EI-FarraMC05,"(47, '-', 40)",129762.29471158981,Match,0.0248720645904541,0.030184030532836914,0.05619502067565918,0.4,0.85
6,3000,A survey of location inference techniques on Twitter.,2282112529,journals/jis/AjaoHL15,"(22, '-', 8)",129762.29471158981,Match,0.011989116668701172,0.018792390823364258,0.03152060508728027,0.4,0.85
6,3000,Origins of the APT language for automatically programmed tools.,2116012084,conf/hopl/Ross78,"(31, '-', 10)",129762.29471158981,Match,0.022244691848754883,0.02901005744934082,0.05232954025268555,0.4,0.85
6,3000,Debate on software reuse libraries.,2116018569,conf/icsr/Poulin94a,"(25, '-', 10)",129762.29471158981,Match,0.0065670013427734375,0.007899761199951172,0.014794588088989258,0.4,0.85
6,3000,Generating random braids.,2116019497,journals/jct/GebhardtG13,"(12, '-', 7)",129762.29471158981,Match,0.002360105514526367,0.0031745433807373047,0.0056722164154052734,0.4,0.85
6,3000,A miniature jumping robot with self-recovery capabilities.,2116021013,conf/iros/KovacSZF09a,"(39, '-', 11)",129762.29471158981,Match,0.018154144287109375,0.02738332748413086,0.04657578468322754,0.4,0.85
6,3000,Routine as resource for the design of learning systems.,2049946683,conf/huc/Davidoff10,"(25, '-', 8)",129762.29471158981,Match,0.010206460952758789,0.013499021530151367,0.02423882484436035,0.4,0.85
6,3000,Autoplot: A browser for scientific data on the web,2116029584,journals/corr/abs-1004-2447,"(27, '-', 12)",129762.29471158981,Match,0.007868528366088867,0.008769512176513672,0.01697397232055664,0.4,0.85
6,3000,A stochastic model for active fire detection using the thermal bands of MODIS data.,2116032979,conf/igarss/LiewLK04,"(36, '-', 9)",129762.29471158981,Match,0.013870477676391602,0.020591020584106445,0.03527665138244629,0.4,0.85
6,3000,Treewidth of graphs with balanced separations.,2116039510,journals/jct/DvorakN19,"(30, '-', 12)",129762.29471158981,Match,0.014819860458374023,0.02123093605041504,0.036890268325805664,0.4,0.85
6,3000,Balancing clusters to reduce response time variability in large scale image search.,2116045373,conf/cbmi/TavenardJA11,"(60, '-', 16)",129762.29471158981,Match,0.03190302848815918,0.04483485221862793,0.07839751243591309,0.4,0.85
6,3000,Message from the guest editors.,2282143953,journals/ijisec/AhmedNSSW12,"(23, '-', 23)",129762.29471158981,Match,0.017037391662597656,0.018235445022583008,0.03595709800720215,0.4,0.85
6,3000,Combining deformable- and rigid-body mechanics simulation.,2116052164,journals/vc/JanssonV03,"(29, '-', 12)",129762.29471158981,Match,0.022340059280395508,0.03179478645324707,0.05531477928161621,0.4,0.85
6,3000,Minimum-time control of coupled tendon-driven manipulators.,2116058643,conf/iros/MaW00a,"(28, '-', 12)",129762.29471158981,Match,0.018441438674926758,0.029546260833740234,0.049083709716796875,0.4,0.85
6,3000,Inference in stochastic frontier analysis with dependent error terms.,2049968985,journals/mcs/MehdiH14,"(39, '-', 39)",129762.29471158981,Match,0.015398502349853516,0.02604389190673828,0.042421579360961914,0.4,0.85
6,3000,Editorial message: special track on object oriented programming languages and systems.,2049973308,conf/sac/AnconaRV05,"(50, '-', 46)",129762.29471158981,Match,0.03144264221191406,0.04818224906921387,0.08139801025390625,0.4,0.85
6,3000,Equality conditions for the quantum <i>f</i>-relative entropy and generalized data processing inequalities.,2116070584,journals/qip/Sharma12,"(51, '-', 16)",129762.29471158981,Match,0.029385089874267578,0.03626108169555664,0.06697726249694824,0.4,0.85
6,3000,A scheme for multiple on-chip signature checking for embedded SRAMS.,2116080822,journals/jsa/AbdullaRK00,"(32, '-', 11)",129762.29471158981,Match,0.024964332580566406,0.032531023025512695,0.05874276161193848,0.4,0.85
6,3000,X-Ability: a theory of replication.,2049984501,journals/dc/FrolundG01,"(13, '-', 10)",129762.29471158981,Match,0.006475925445556641,0.01090383529663086,0.017777681350708008,0.4,0.85
6,3000,Supervisory control of switching control systems.,2116105684,conf/cdc/TousiKHA06,"(24, '-', 12)",129762.29471158981,Match,0.010819673538208008,0.013655900955200195,0.025037050247192383,0.4,0.85
6,3000,Cooperative and distributed localization for wireless sensor networks in multipath environments.,2116107576,conf/IEEEicics/LengTQ11,"(48, '-', 25)",129762.29471158981,Match,0.041457176208496094,0.04671430587768555,0.08989477157592773,0.4,0.85
6,3000,Approximating the Gaussian multiple description rate region under symmetric distortion constraints.,2049999089,conf/isit/TianMD08,"(53, '-', 27)",129762.29471158981,Match,0.03597712516784668,0.04824542999267578,0.08602619171142578,0.4,0.85
6,3000,Snap-together motion: assembling run-time animations.,2050000272,conf/siggraph/GleicherSKJ08,"(26, '-', 26)",129762.29471158981,Match,0.009642839431762695,0.017419815063476562,0.027737855911254883,0.4,0.85
6,3000,Packed integer wavelet transform constructed by lifting scheme.,2116116824,conf/icassp/LinZZ99,"(47, '-', 18)",129762.29471158981,Match,0.025870561599731445,0.038196563720703125,0.06547141075134277,0.4,0.85
6,3000,On strong homogeneity of two global optimization algorithms based on statistical models of multimodal objective functions.,2116117196,journals/amc/Zilinskas12,"(69, '-', 26)",129762.29471158981,Match,0.04218888282775879,0.052407264709472656,0.09655475616455078,0.4,0.85
6,3000,Planar segment visibility graphs.,2050004894,conf/cccg/EverettHKN97,"(20, '-', 10)",129762.29471158981,Match,0.008621692657470703,0.014612197875976562,0.02381443977355957,0.4,0.85
6,3000,The measurement of Italian universities' research productivity by a non parametric-bibliometric methodology.,2050010356,journals/scientometrics/AbramoDP08,"(52, '-', 16)",129762.29471158981,Match,0.027716875076293945,0.037743330001831055,0.06694602966308594,0.4,0.85
6,3000,Can we allow linear dependencies in the dictionary in the sparse synthesis framework?,2050011800,conf/icassp/GiryesE13,"(49, '-', 11)",129762.29471158981,Match,0.022975921630859375,0.03819751739501953,0.06258249282836914,0.4,0.85
6,3000,Adaptive fast multipole methods on the GPU.,2050013934,journals/tjs/GoudeE13,"(21, '-', 14)",129762.29471158981,Match,0.008723974227905273,0.017194747924804688,0.02657794952392578,0.4,0.85
6,3000,Fuzzy soft subspace clustering method for gene co-expression network analysis.,2116141847,conf/bibm/WangYHF10,"(40, '-', 16)",129762.29471158981,Match,0.021562814712524414,0.027564048767089844,0.05013895034790039,0.4,0.85
6,3000,Packet mode and QoS algorithms for buffered crossbar switches with FIFO queuing.,2050020523,conf/podc/KesselmanKS08,"(41, '-', 11)",129762.29471158981,Match,0.010618925094604492,0.0180206298828125,0.029328107833862305,0.4,0.85
6,3000,Makespan minimization in online scheduling with machine eligibility.,2050020724,journals/4or/LeeLP10,"(38, '-', 18)",129762.29471158981,Match,0.01685047149658203,0.022574901580810547,0.04030418395996094,0.4,0.85
6,3000,Laziness pays! Using lazy synchronization mechanisms to improve non-blocking constructions.,2050022434,journals/dc/Moir01,"(48, '-', 17)",129762.29471158981,Match,0.034020185470581055,0.044898271560668945,0.08061337471008301,0.4,0.85
6,3000,Impact of the Corrective Maintenance Cost on Manufacturing Remanufacturing System Performance.,2282225814,conf/mco/TurkiHR15,"(37, '-', 40)",129762.29471158981,Match,0.04956984519958496,0.04108119010925293,0.09218525886535645,0.4,0.85
6,3000,Holonic control of an engine assembly plant: an industrial evaluation.,2116162266,conf/smc/BussmannS01,"(39, '-', 16)",129762.29471158981,Match,0.015691280364990234,0.021625518798828125,0.038141727447509766,0.4,0.85
6,3000,"Final Algebras, Cosemicomputable Algebras, and Degrees of Unsolvability.",2050029329,conf/ctcs/MossMG87,"(21, '-', 19)",129762.29471158981,Match,0.010456085205078125,0.015533208847045898,0.02659773826599121,0.4,0.85
6,3000,Provenance Support for Data-Intensive Scientific Workflows.,2116175609,books/sp/fiore2011/KhanB11,"(17, '-', 20)",129762.29471158981,Match,0.03238677978515625,0.03995800018310547,0.07381677627563477,0.4,0.85
6,3000,Drawing graphs with vertices and edges in convex position.,2116176999,journals/corr/Garcia-MarcoK15a,"(41, '-', 13)",129762.29471158981,Match,0.019081592559814453,0.03278946876525879,0.05315089225769043,0.4,0.85
6,3000,Letter to the editor.,2050036606,journals/di/Nikkel05a,"(9, '-', 9)",129762.29471158981,Match,0.003907918930053711,0.00786733627319336,0.012071609497070312,0.4,0.85
6,3000,Spotlighting Student Innovation.,2050039979,journals/computer/Byrd15,"(11, '-', 12)",129762.29471158981,Match,0.013135433197021484,0.014994144439697266,0.02872943878173828,0.4,0.85
6,3000,Equivalence classes of Boolean functions for first-order correlation.,2116183729,journals/tit/BarsV10,"(35, '-', 17)",129762.29471158981,Match,0.022428035736083984,0.03016042709350586,0.05373954772949219,0.4,0.85
6,3000,&#948;-MAPS: From spatio-temporal data to a weighted and lagged network between functional domains.,2282251185,journals/corr/FountalisBDDK16,"(50, '-', 13)",129762.29471158981,Match,0.021221637725830078,0.032240867614746094,0.0547175407409668,0.4,0.85
6,3000,Ermittlung von Verwundbarkeiten mit elektronischen K&ouml;dern.,2282253395,conf/dimva/DornseifGH04,"(33, '-', 14)",129762.29471158981,Match,0.0017826557159423828,0.0020558834075927734,0.003930091857910156,0.4,0.85
6,3000,Minimum classification error linear regression for acoustic model adaptation of continuous density HMMs.,2116196769,conf/icassp/HeC03,"(56, '-', 15)",129762.29471158981,Match,0.036010026931762695,0.04852437973022461,0.08631706237792969,0.4,0.85
6,3000,Incentives for social annotation.,2050048591,conf/ht/RoinestadBMM09,"(20, '-', 11)",129762.29471158981,Match,0.013935565948486328,0.01929616928100586,0.0339512825012207,0.4,0.85
6,3000,Information dense summaries for review of patient performance in biofeedback rehabilitation.,2116208432,conf/mm/XuS07a,"(57, '-', 14)",129762.29471158981,Match,0.03069138526916504,0.043071746826171875,0.07535338401794434,0.4,0.85
6,3000,Non-negative sparse coding.,2116216716,conf/nnsp/Hoyer02,"(14, '-', 9)",129762.29471158981,Match,0.00634312629699707,0.007678508758544922,0.014362335205078125,0.4,0.85
6,3000,Expected Heights in Heaps.,2050059752,journals/bit/GraafK92,"(6, '-', 11)",129762.29471158981,Match,0.0033216476440429688,0.005599260330200195,0.009126424789428711,0.4,0.85
6,3000,Asynchronous Deterministic Rendezvous in Graphs.,2050063944,conf/mfcs/MarcoGKKPV05,"(17, '-', 29)",129762.29471158981,Match,0.021755456924438477,0.02292656898498535,0.0455477237701416,0.4,0.85
6,3000,Algorithmic Painter: a NPR method to generate various styles of painting.,2050066218,journals/vc/KasaoM06,"(39, '-', 9)",129762.29471158981,Match,0.014998435974121094,0.022336959838867188,0.03823256492614746,0.4,0.85
6,3000,A new approach to schedule operations across nested-ifs and nested-loops.,2116229235,conf/micro/HuangHHO92,"(41, '-', 11)",129762.29471158981,Match,0.010982513427734375,0.015571355819702148,0.027173280715942383,0.4,0.85
6,3000,Qualitative Logics and Equivalences for Probabilistic Systems.,2050070313,conf/qest/AlfaroCFL07,"(16, '-', 13)",129762.29471158981,Match,0.02974843978881836,0.0407109260559082,0.07199573516845703,0.4,0.85
6,3000,A Bayesian learning approach to linear system identification with missing data.,2116245597,conf/cdc/PillonettoC09,"(32, '-', 13)",129762.29471158981,Match,0.015506267547607422,0.021474838256835938,0.03786206245422363,0.4,0.85
