k,num_removed_kmers,candidate_paper_title,candidate_mag_id,candidate_dblp_id,ratio,hashmap_build_time,match,average_query_time_phase1,average_query_time_phase2,average_query_time_total,levenshteinThreshold,ratioThreshold
6,3000,Hierarchical approach to exact symbolic analysis of large analog circuits.,2118166414,conf/dac/TanGQ04,"(43, '-', 17)",129762.29471158981,Match,0.01836228370666504,0.02927088737487793,0.04874014854431152,0.4,0.85
6,3000,A practical exact motion planning algorithm for polygonal object amidst polygonal obstacles.,2118175378,conf/georob/AvnaimBF88,"(75, '-', 37)",129762.29471158981,Match,0.023159265518188477,0.032894134521484375,0.057289838790893555,0.4,0.85
6,3000,A Counterexample to Strong Parallel Repetition.,2051184870,journals/siamcomp/Raz11,"(16, '-', 16)",129762.29471158981,Match,0.013523578643798828,0.020635128021240234,0.03495001792907715,0.4,0.85
6,3000,Towards a low bandwidth talking face using appearance models.,2051185171,conf/bmvc/TheobaldCKB01,"(47, '-', 13)",129762.29471158981,Match,0.02521681785583496,0.03555893898010254,0.06219220161437988,0.4,0.85
6,3000,Channel equalization using radial basis function network.,2118183154,conf/icnn/LeeBT96,"(30, '-', 22)",129762.29471158981,Match,0.014125585556030273,0.01969003677368164,0.03463625907897949,0.4,0.85
6,3000,Partial fillup and search time in LC tries.,2283807851,journals/talg/JansonS07,"(24, '-', 7)",129762.29471158981,Match,0.006508827209472656,0.012781620025634766,0.019797801971435547,0.4,0.85
6,3000,Optimal wavelet expansion via sampled-data control theory.,2118192096,conf/cdc/KashimaYN01,"(35, '-', 13)",129762.29471158981,Match,0.01564311981201172,0.018778085708618164,0.03520393371582031,0.4,0.85
6,3000,On the automatic simplification of source-language programs.,2118196742,journals/cacm/Clark67,"(28, '-', 28)",129762.29471158981,Match,0.017642736434936523,0.02551579475402832,0.044106483459472656,0.4,0.85
6,3000,Capacity analysis of multi-hop wireless sensor networks using multiple transmission channels: A case study using IEEE 802.15.4 based networks.,2118202188,conf/lcn/NamboothiriS10,"(58, '-', 19)",129762.29471158981,Match,0.04428410530090332,0.051761627197265625,0.0979769229888916,0.4,0.85
6,3000,Beyond data: from user information to business value through personalized recommendations and consumer science.,2051199128,conf/cikm/Amatriain13a,"(60, '-', 15)",129762.29471158981,Match,0.029896259307861328,0.04089021682739258,0.0722954273223877,0.4,0.85
6,3000,Prolog to: Burst-by-burst adaptive multiuser detection CDMA: a framework for existing and future wireless standards.,2051207160,journals/pieee/ODonnell03,"(57, '-', 15)",129762.29471158981,Match,0.03433346748352051,0.04678845405578613,0.08286690711975098,0.4,0.85
6,3000,An improved frequency weighted balancing related technique with error bounds.,2118224995,conf/cdc/Sreeram04,"(48, '-', 13)",129762.29471158981,Match,0.023907184600830078,0.03439450263977051,0.05963730812072754,0.4,0.85
6,3000,Selecting SNPs for pharmacogenomic association study.,2118231653,conf/bibm/AhnPSHLBPOLRKP10,"(28, '-', 15)",129762.29471158981,Match,0.01622629165649414,0.027637243270874023,0.044930458068847656,0.4,0.85
6,3000,Broadcasting on Faulty Hypercubes.,2118236141,conf/icpads/SuiWL94,"(10, '-', 14)",129762.29471158981,Match,0.008367538452148438,0.011849164962768555,0.020702838897705078,0.4,0.85
6,3000,Double rulings for information brokerage in sensor networks.,2051223818,conf/mobicom/SarkarZG06,"(39, '-', 14)",129762.29471158981,Match,0.020604848861694336,0.02969837188720703,0.05143547058105469,0.4,0.85
6,3000,Bounded Expected Delay in Arithmetic Coding.,2118252589,conf/isit/ShayevitzZF06,"(12, '-', 13)",129762.29471158981,Match,0.013813972473144531,0.017426013946533203,0.031920671463012695,0.4,0.85
6,3000,An invariance principle for polytopes.,2118259999,conf/stoc/HarshaKM10,"(29, '-', 14)",129762.29471158981,Match,0.016975879669189453,0.02261519432067871,0.0404505729675293,0.4,0.85
6,3000,Identifying the components.,2118262358,journals/datamine/LeeuwenVS09,"(11, '-', 7)",129762.29471158981,Match,0.014819622039794922,0.02104949951171875,0.0366513729095459,0.4,0.85
6,3000,Modular architectures for adaptive multichannel lattice algorithms.,2118264379,conf/icassp/Lev-Ari83,"(35, '-', 14)",129762.29471158981,Match,0.02130889892578125,0.030579566955566406,0.05305218696594238,0.4,0.85
6,3000,Access control management for e-Healthcare in cloud environment.,2118270802,journals/corr/abs-1711-10553,"(31, '-', 18)",129762.29471158981,Match,0.024075984954833984,0.02717423439025879,0.052285194396972656,0.4,0.85
6,3000,Robust sliding mode observer-based actuator fault detection and isolation for a class of nonlinear systems.,2118274697,conf/cdc/YanE05,"(63, '-', 34)",129762.29471158981,Match,0.036931514739990234,0.04644036293029785,0.08512163162231445,0.4,0.85
6,3000,Constructing Level-2 Phylogenetic Networks from Triplets.,2118275957,conf/recomb/IerselKKSHB08,"(11, '-', 24)",129762.29471158981,Match,0.007911443710327148,0.0130157470703125,0.021454811096191406,0.4,0.85
6,3000,Frequency-hopped multilevel frequency shift keying spread spectrum for mobile radio communication systems (Ph.D. Thesis abstr.).,2118277314,journals/tit/Muammar83,"(73, '-', 19)",129762.29471158981,Match,0.031212568283081055,0.03497910499572754,0.06749963760375977,0.4,0.85
6,3000,Is it live or is it Memorex?,2118279955,conf/siguccs/SawyerAM86,"(16, '-', 6)",129762.29471158981,Match,0.0008976459503173828,0.0013818740844726562,0.0023517608642578125,0.4,0.85
6,3000,An effective hyper-dense deployment algorithm via search economics.,2283883526,journals/jaihc/TsaiL20,"(31, '-', 14)",129762.29471158981,Match,0.016849756240844727,0.01816534996032715,0.03574061393737793,0.4,0.85
6,3000,Improving accuracy of host load predictions on computational grids by artificial neural networks.,2118282214,conf/ipps/DuySI09,"(51, '-', 15)",129762.29471158981,Match,0.025110244750976562,0.03273487091064453,0.059073686599731445,0.4,0.85
6,3000,Efficient parallel algorithms for robot forward dynamics computation.,2118284853,conf/icra/LeeC87a,"(33, '-', 11)",129762.29471158981,Match,0.014849185943603516,0.021364688873291016,0.037088871002197266,0.4,0.85
6,3000,Serially concatenated space-time code using 2D interleaver.,2118292018,conf/globecom/YukYHK01,"(37, '-', 17)",129762.29471158981,Match,0.014698505401611328,0.026078462600708008,0.04177546501159668,0.4,0.85
6,3000,Mode preference in a simple data-retrieval task.,2051250422,conf/chi/Rudnicky93,"(24, '-', 8)",129762.29471158981,Match,0.011951446533203125,0.022671222686767578,0.03548431396484375,0.4,0.85
6,3000,Algebraic constructions of LDPC codes with no short cycles.,2051256219,journals/ijicot/HurleyMW10,"(27, '-', 12)",129762.29471158981,Match,0.00993037223815918,0.014803647994995117,0.0252993106842041,0.4,0.85
6,3000,Student de-charter notice.,2118319772,journals/cacm/Xx06c,"(12, '-', 4)",129762.29471158981,Match,0.0029137134552001953,0.00565648078918457,0.008797168731689453,0.4,0.85
6,3000,Routing and scheduling in multihop wireless networks with time-varying channels.,2118323031,conf/soda/AndrewsZ04,"(39, '-', 17)",129762.29471158981,Match,0.030521631240844727,0.03963899612426758,0.0716552734375,0.4,0.85
6,3000,Relative expressive power of navigational querying on graphs.,2118328008,conf/icdt/FletcherGLBGVW11,"(38, '-', 12)",129762.29471158981,Match,0.017850160598754883,0.02942681312561035,0.04839587211608887,0.4,0.85
6,3000,Robust topology-adaptive snakes for image segmentation.,2051272454,conf/icip/JiY01,"(27, '-', 12)",129762.29471158981,Match,0.018040180206298828,0.02637314796447754,0.04542684555053711,0.4,0.85
6,3000,Privacy Contracts as an Extension of Privacy Policies.,2118333568,conf/icde/OberholzerO05,"(14, '-', 14)",129762.29471158981,Match,0.01895761489868164,0.024245023727416992,0.04412031173706055,0.4,0.85
6,3000,Remark on algorithm 178 [E4]: direct search.,2118337560,journals/cacm/Smith69b,"(19, '-', 19)",129762.29471158981,Match,0.006871223449707031,0.01195526123046875,0.019292593002319336,0.4,0.85
6,3000,Cyberprivacy in the New Millennium.,2118342527,journals/computer/Berghel01,"(13, '-', 14)",129762.29471158981,Match,0.005519866943359375,0.009337663650512695,0.015233755111694336,0.4,0.85
6,3000,Intelligent Assistive Interfaces for Editing Mathematics.,2118345407,conf/intenv/AttanayakeDHPW12,"(12, '-', 12)",129762.29471158981,Match,0.02677464485168457,0.03989672660827637,0.06816411018371582,0.4,0.85
6,3000,Bipartite roots of graphs.,2118345845,conf/soda/Lau04,"(17, '-', 11)",129762.29471158981,Match,0.005202293395996094,0.008131742477416992,0.013637304306030273,0.4,0.85
6,3000,The myth of the Folk Theorem.,2051280392,journals/geb/BorgsCIKMP10,"(8, '-', 14)",129762.29471158981,Match,0.004805326461791992,0.009065389633178711,0.014234781265258789,0.4,0.85
6,3000,WiFi leakage detection in LTE downlink for in-device interference avoidance.,2051286855,conf/icc/LiPW14,"(35, '-', 15)",129762.29471158981,Match,0.023542404174804688,0.03596138954162598,0.060881614685058594,0.4,0.85
6,3000,Non-invasive light-weight integration engine for building EHR from autonomous distributed systems.,2118363707,conf/mie/MolinaFSCV06,"(47, '-', 13)",129762.29471158981,Match,0.03309774398803711,0.03910255432128906,0.07368350028991699,0.4,0.85
6,3000,Technology for losers: Re-equipping the excluded.,2118365753,conf/kaleidoscope/Sutinen09,"(21, '-', 5)",129762.29471158981,Match,0.010587692260742188,0.016568660736083984,0.027823686599731445,0.4,0.85
6,3000,An achievable rate for the multiple-level relay channel.,2051291905,journals/tit/XieK05,"(33, '-', 13)",129762.29471158981,Match,0.011708259582519531,0.019039154052734375,0.03148961067199707,0.4,0.85
6,3000,"Gramians, generalized inverses, and the least-squares approximation of optical flow.",2051292079,journals/jvcir/Brockett90,"(33, '-', 17)",129762.29471158981,Match,0.010969877243041992,0.016362905502319336,0.027980566024780273,0.4,0.85
6,3000,Minimum dilation stars.,2118380034,conf/compgeom/EppsteinW05,"(13, '-', 6)",129762.29471158981,Match,0.004819631576538086,0.0065877437591552734,0.011677980422973633,0.4,0.85
6,3000,Corrigendum to: A new cis-acting regulatory element driving gene expression in the zebrafish pineal gland.,2118388673,journals/bioinformatics/AlonEJRVTCKG19,"(61, '-', 20)",129762.29471158981,Match,0.019895553588867188,0.031039714813232422,0.052103281021118164,0.4,0.85
6,3000,On the synthesis of controllers for a non-overshooting step response.,2118389728,conf/icarcv/DarbhaB02,"(36, '-', 10)",129762.29471158981,Match,0.01623821258544922,0.027460098266601562,0.04473280906677246,0.4,0.85
6,3000,LMI tools for eventually periodic systems.,2118397745,conf/amcc/FarhoodD02,"(28, '-', 24)",129762.29471158981,Match,0.010569334030151367,0.014786005020141602,0.02597522735595703,0.4,0.85
6,3000,Light spanners for Snowflake Metrics.,2118398082,conf/compgeom/GottliebS14,"(15, '-', 7)",129762.29471158981,Match,0.003930330276489258,0.007838249206542969,0.012073993682861328,0.4,0.85
6,3000,Minimizing the sum of many rational functions.,2118400056,journals/mpc/BugarinHL16,"(26, '-', 13)",129762.29471158981,Match,0.013441801071166992,0.018353700637817383,0.03260087966918945,0.4,0.85
6,3000,Exhaustive stability analysis in a consensus system with time delay and irregular topologies.,2118403572,conf/amcc/Cepeda-GomezO11,"(61, '-', 16)",129762.29471158981,Match,0.03705620765686035,0.046308279037475586,0.08511471748352051,0.4,0.85
6,3000,A generalization of commuting graphs.,2118403623,journals/dmaa/AfkhamiBHK15,"(15, '-', 9)",129762.29471158981,Match,0.010986566543579102,0.020471811294555664,0.032251834869384766,0.4,0.85
6,3000,Random perturbations of dynamical systems with reflecting boundary and corresponding PDE with a small parameter.,2118406048,journals/asy/HuT14,"(68, '-', 17)",129762.29471158981,Match,0.04323387145996094,0.055615901947021484,0.10094380378723145,0.4,0.85
6,3000,Uncertain probabilities II: the continuous case.,2118408393,journals/soco/BuckleyE04,"(19, '-', 19)",129762.29471158981,Match,0.017706871032714844,0.027359724044799805,0.04609847068786621,0.4,0.85
6,3000,Learning as applied to stochastic optimization for standard-cellplacement.,2118423863,journals/tcad/SuBNP01,"(32, '-', 18)",129762.29471158981,Match,0.024965286254882812,0.02626514434814453,0.052222490310668945,0.4,0.85
6,3000,Performance modeling of automated manufacturing systems.,2051327289,journals/automatica/EgardtL95,"(27, '-', 25)",129762.29471158981,Match,0.026364803314208984,0.0277101993560791,0.05515885353088379,0.4,0.85
6,3000,The virtual showcase.,2051329650,conf/siggraph/BimberFSE05,"(12, '-', 7)",129762.29471158981,Match,0.0016167163848876953,0.0018954277038574219,0.0036020278930664062,0.4,0.85
6,3000,On the construction of multiphase communication protocols.,2118436021,conf/icnp/SinghS94,"(27, '-', 13)",129762.29471158981,Match,0.02542567253112793,0.03634977340698242,0.06309628486633301,0.4,0.85
6,3000,Affine equivalence of cubic homogeneous rotation symmetric Boolean functions,2118439495,journals/corr/abs-1007-1938,"(38, '-', 28)",129762.29471158981,Match,0.017630338668823242,0.021513938903808594,0.04001927375793457,0.4,0.85
6,3000,Simple versus optimal mechanisms.,2118442327,conf/sigecom/HartlineR09,"(20, '-', 8)",129762.29471158981,Match,0.010284662246704102,0.01634359359741211,0.027300119400024414,0.4,0.85
6,3000,Inter-cell coordinated beamforming with opportunistic scheduling.,2118444155,conf/icc/KimHK13,"(40, '-', 17)",129762.29471158981,Match,0.02407979965209961,0.02198958396911621,0.04692196846008301,0.4,0.85
6,3000,Equations for secant varieties of Chow varieties.,2284008619,journals/corr/Guan16,"(35, '-', 17)",129762.29471158981,Match,0.006916046142578125,0.012989997863769531,0.020440340042114258,0.4,0.85
6,3000,A hybrid MAC protocol for wireless sensor networks.,2118448298,conf/icnsc/HsiehLW15,"(22, '-', 20)",129762.29471158981,Match,0.018976926803588867,0.01815176010131836,0.03784537315368652,0.4,0.85
6,3000,A Kuratowski-type theorem for planarity of partially embedded graphs.,2118451085,journals/comgeo/JelinekKR13,"(44, '-', 15)",129762.29471158981,Match,0.02107095718383789,0.033193111419677734,0.05550432205200195,0.4,0.85
6,3000,"IQRray, a new method for Affymetrix microarray quality control, and the homologous organ conservation score, a new benchmark method for quality control metrics.",2118451750,journals/bioinformatics/RosikiewiczR16,"(109, '-', 16)",129762.29471158981,Match,0.02910923957824707,0.03194880485534668,0.06227898597717285,0.4,0.85
6,3000,A two-stage stochastic programming framework for evacuation planning in disaster responses.,2118465040,journals/candie/Wang20,"(39, '-', 25)",129762.29471158981,Match,0.03082585334777832,0.04130411148071289,0.07372641563415527,0.4,0.85
6,3000,An enhanced GSO technique for wireless sensor networks optimization.,2118477273,conf/cec/CaputoGMZ08,"(27, '-', 20)",129762.29471158981,Match,0.02082967758178711,0.02211594581604004,0.043782949447631836,0.4,0.85
6,3000,The Isomorphism Conjecture Holds Relative to an Oracle.,2118479312,journals/siamcomp/FennerFK96,"(13, '-', 13)",129762.29471158981,Match,0.009778499603271484,0.013179302215576172,0.023464202880859375,0.4,0.85
6,3000,Single-fault fault-collapsing analysis in sequential logic circuits.,2118480944,journals/tcad/ChenLS91,"(40, '-', 17)",129762.29471158981,Match,0.020548582077026367,0.027172088623046875,0.04876208305358887,0.4,0.85
6,3000,Data access optimizations for highly threaded multi-core CPUs with multiple memory controllers.,2118489519,conf/ipps/HagerZW08,"(45, '-', 12)",129762.29471158981,Match,0.016297340393066406,0.025382041931152344,0.04264116287231445,0.4,0.85
6,3000,A High-Speed Brain Speller using steady-State Visual evoked potentials.,2051360945,journals/ijns/NakanishiWWMJ14,"(28, '-', 30)",129762.29471158981,Match,0.0171968936920166,0.024114370346069336,0.04221177101135254,0.4,0.85
6,3000,Joint source-channel coding via statistical mechanics: thermal equilibrium between the source and the channel,2118493497,journals/corr/abs-0810-2164,"(71, '-', 69)",129762.29471158981,Match,0.037172555923461914,0.04168248176574707,0.08039188385009766,0.4,0.85
6,3000,The Medium is the Message.,2284046211,conf/icc/Fitzek06,"(9, '-', 9)",129762.29471158981,Match,0.006647348403930664,0.012614727020263672,0.019771099090576172,0.4,0.85
6,3000,Robust approach for estimating probabilities in Na&iuml;ve-Bayes Classifier for gene expression data.,2051363361,journals/eswa/ChandraG11,"(39, '-', 15)",129762.29471158981,Match,0.034238576889038086,0.0449831485748291,0.08089709281921387,0.4,0.85
6,3000,Pole placement adaptive control with persistent jumps in the plant parameters.,2118494660,conf/cdc/MillerV10,"(52, '-', 21)",129762.29471158981,Match,0.03239250183105469,0.04255342483520508,0.07655525207519531,0.4,0.85
6,3000,Beyond concern - a privacy-trust-behavioral intention model of electronic commerce.,2118501966,journals/iam/LiuMLY05,"(41, '-', 16)",129762.29471158981,Match,0.027720212936401367,0.035181283950805664,0.06422281265258789,0.4,0.85
6,3000,Sparse halves in dense triangle-free graphs.,2118502851,journals/jct/NorinY15,"(18, '-', 14)",129762.29471158981,Match,0.0055561065673828125,0.009502172470092773,0.015450000762939453,0.4,0.85
6,3000,Extremum seeking methods for optimization of variable cam timing engine operation.,2118504053,conf/amcc/PopovicJMT03,"(48, '-', 15)",129762.29471158981,Match,0.014841318130493164,0.020363330841064453,0.03605389595031738,0.4,0.85
6,3000,Using ontology for resume annotation.,2118507881,journals/ijmso/KaraaM11,"(22, '-', 10)",129762.29471158981,Match,0.013776302337646484,0.019227266311645508,0.03375363349914551,0.4,0.85
6,3000,Average of Synthetic Exact Filters.,2118508489,conf/cvpr/BolmeDB09,"(10, '-', 12)",129762.29471158981,Match,0.01823258399963379,0.022950172424316406,0.042041778564453125,0.4,0.85
6,3000,Adoption versus use diffusion of iDTV in flanders - personalized television content as a tool to cross the chasm?,2118518469,journals/cie/SchuurmanMB11,"(75, '-', 14)",129762.29471158981,Match,0.03295612335205078,0.046935081481933594,0.08164143562316895,0.4,0.85
6,3000,Coloring permutation graphs in parallel.,2051385809,journals/dam/Nikolopoulos02,"(24, '-', 12)",129762.29471158981,Match,0.01066732406616211,0.01584315299987793,0.027135848999023438,0.4,0.85
6,3000,Asymptotics of the number of threshold functions on a two-dimensional rectangular grid.,2051389468,journals/dam/HaukkanenM13,"(52, '-', 27)",129762.29471158981,Match,0.036180734634399414,0.0400388240814209,0.07773971557617188,0.4,0.85
6,3000,Decidability of Bisimulation Equivalence for Normed Pushdown Processes.,2118539487,journals/tcs/Stirling98,"(18, '-', 18)",129762.29471158981,Match,0.018686532974243164,0.02723407745361328,0.0469813346862793,0.4,0.85
6,3000,Capacity bounds and constructions for reversible data-hiding.,2051393035,conf/sswmc/KalkerW03,"(31, '-', 24)",129762.29471158981,Match,0.02263641357421875,0.03388047218322754,0.05777454376220703,0.4,0.85
6,3000,do you see what i see 15.,2118548262,conf/siggraph/Vetere06,"(16, '-', 10)",129762.29471158981,Match,0.00024247169494628906,0.0002346038818359375,0.0004923343658447266,0.4,0.85
6,3000,Heapviz: Interactive heap visualization for program understanding and debugging.,2118558212,journals/ivs/KelleyAGRSG13,"(32, '-', 11)",129762.29471158981,Match,0.015780210494995117,0.023650646209716797,0.04036283493041992,0.4,0.85
6,3000,Experimental results on the nonlinear H<sub>&#8734;</sub> control via quasi-LPV representation and game theory for wheeled mobile robots.,2118561038,conf/IEEEcca/InoueST07,"(62, '-', 20)",129762.29471158981,Match,0.03040337562561035,0.040869712829589844,0.07278680801391602,0.4,0.85
6,3000,NWE: Node-weighted expansion for protein complex prediction using random walk distances.,2118561360,conf/bibm/MaruyamaC10,"(45, '-', 17)",129762.29471158981,Match,0.02234053611755371,0.031286001205444336,0.054847002029418945,0.4,0.85
6,3000,Adaptive spectral estimation by the conjugate gradient method.,2118562150,conf/icassp/ChenSDB85,"(36, '-', 21)",129762.29471158981,Match,0.020488500595092773,0.028534650802612305,0.050109148025512695,0.4,0.85
6,3000,Letter from the Editor.,2051406770,journals/simulation/Yilmaz09,"(9, '-', 9)",129762.29471158981,Match,0.013106346130371094,0.014650821685791016,0.028331279754638672,0.4,0.85
6,3000,Studying the impact of negotiation environments on negotiation teams' performance.,2051409319,journals/corr/Sanchez-AnguixJ16b,"(57, '-', 18)",129762.29471158981,Match,0.02869582176208496,0.034451961517333984,0.06443619728088379,0.4,0.85
6,3000,Memory-efficient segment-based packet-combining schemes in face of deadlines.,2051415412,conf/iwcmc/Willig09,"(42, '-', 13)",129762.29471158981,Match,0.03410673141479492,0.04305243492126465,0.07875704765319824,0.4,0.85
6,3000,New analytic approximation to the standard molecular volume definition and its application to generalized born calculations - Erratum.,2051419785,journals/jcc/LeeFSB03a,"(69, '-', 18)",129762.29471158981,Match,0.03808879852294922,0.04206204414367676,0.08168625831604004,0.4,0.85
6,3000,Design mentoring based on design evolution analysis.,2118599123,conf/icse/Xing05,"(24, '-', 6)",129762.29471158981,Match,0.009373903274536133,0.011213302612304688,0.021059513092041016,0.4,0.85
6,3000,Further numerical studies of backscattering from time-evolving nonlinear sea surfaces.,2118602708,journals/tgrs/HayslipJB03,"(54, '-', 13)",129762.29471158981,Match,0.03192448616027832,0.04538989067077637,0.07905697822570801,0.4,0.85
6,3000,Feedback cancellation in hearing aids.,2118603282,conf/icassp/Kates90,"(21, '-', 21)",129762.29471158981,Match,0.013975381851196289,0.01535177230834961,0.029988527297973633,0.4,0.85
6,3000,On characterizing ribbons and finding skewed symmetries.,2051428111,conf/icra/Ponce89,"(36, '-', 7)",129762.29471158981,Match,0.008342504501342773,0.013229608535766602,0.02210068702697754,0.4,0.85
6,3000,A systems approach for collaborative decision support in water resources planning.,2118606171,conf/istas/BenderS96,"(43, '-', 13)",129762.29471158981,Match,0.020461559295654297,0.030886173248291016,0.052561044692993164,0.4,0.85
6,3000,A dynamic local method for bandwidth adaptation in bundle links to conserve energy in core networks.,2118608014,conf/IEEEants/LiuR11,"(70, '-', 11)",129762.29471158981,Match,0.025313377380371094,0.03711199760437012,0.06378793716430664,0.4,0.85
6,3000,Locally optimal controllers and globally inverse optimal controllers.,2118613602,journals/corr/BenachourSA15,"(52, '-', 21)",129762.29471158981,Match,0.017629146575927734,0.023679018020629883,0.0421903133392334,0.4,0.85
6,3000,Clusters and Maps of Science Journals Based on Bi-connected Graphs in the Journal Citation Reports,2118623738,journals/corr/abs-0912-1221,"(20, '-', 24)",129762.29471158981,Match,0.02915048599243164,0.04391837120056152,0.07468199729919434,0.4,0.85
6,3000,Smoothed analysis of algorithms: Why the simplex algorithm usually takes polynomial time.,2118625817,journals/jacm/SpielmanT04,"(51, '-', 13)",129762.29471158981,Match,0.016974449157714844,0.021329402923583984,0.03910207748413086,0.4,0.85
6,3000,State of the journal.,2051440130,journals/ijmir/Lew16a,"(10, '-', 10)",129762.29471158981,Match,0.004385232925415039,0.005316019058227539,0.009945869445800781,0.4,0.85
6,3000,Combining deblurring and denoising for handheld HDR imaging in low light conditions.,2051441226,conf/cf/Lakshman10,"(53, '-', 17)",129762.29471158981,Match,0.03018355369567871,0.040102481842041016,0.07178902626037598,0.4,0.85
6,3000,The painful face - Pain expression recognition using active appearance models.,2118640726,journals/ivc/AshrafLCCAPS09,"(42, '-', 14)",129762.29471158981,Match,0.016892433166503906,0.023043155670166016,0.0408627986907959,0.4,0.85
6,3000,1-perfectly orientable graphs and graph products.,2284172706,journals/dm/HartingerM17,"(35, '-', 12)",129762.29471158981,Match,0.016305208206176758,0.0264432430267334,0.04375863075256348,0.4,0.85
6,3000,Second workshop on dependable and secure nanocomputing.,2118657369,conf/dsn/ArlatCIN08,"(33, '-', 16)",129762.29471158981,Match,0.011463642120361328,0.015110015869140625,0.02715301513671875,0.4,0.85
6,3000,Optimizing sensor movement planning for energy efficiency.,2051462265,conf/islped/WangIBFP05,"(30, '-', 14)",129762.29471158981,Match,0.016037464141845703,0.024373292922973633,0.04133868217468262,0.4,0.85
6,3000,Computational geometry column 23.,2284193075,journals/ijcga/ORourke94a,"(15, '-', 15)",129762.29471158981,Match,0.005987644195556641,0.00898122787475586,0.015323162078857422,0.4,0.85
6,3000,The ethnographically informed participatory design of a PD application to support communication.,2118684564,conf/assets/DaviesMMP04,"(46, '-', 19)",129762.29471158981,Match,0.022518634796142578,0.030342817306518555,0.05402874946594238,0.4,0.85
6,3000,Uncovering student values for hiring in the software industry.,2051479912,conf/icer/ChinnV07,"(42, '-', 13)",129762.29471158981,Match,0.028788328170776367,0.04387855529785156,0.07434511184692383,0.4,0.85
6,3000,Multidimensional reconciliation for continuous-variable quantum key distribution.,2118704262,conf/isit/LeverrierABZG08,"(39, '-', 31)",129762.29471158981,Match,0.01990032196044922,0.026716232299804688,0.04760384559631348,0.4,0.85
6,3000,Level set evolution with locally linear classification for image segmentation.,2118713142,conf/icip/WangWXP11,"(36, '-', 14)",129762.29471158981,Match,0.01566314697265625,0.022134780883789062,0.038663625717163086,0.4,0.85
6,3000,Affine equivalence for rotation symmetric Boolean functions with p<sup>k</sup> variables.,2051491799,journals/ffa/CusickB12,"(38, '-', 30)",129762.29471158981,Match,0.029329776763916016,0.042029619216918945,0.07294964790344238,0.4,0.85
