k,num_removed_kmers,candidate_paper_title,candidate_mag_id,candidate_dblp_id,ratio,hashmap_build_time,match,average_query_time_phase1,average_query_time_phase2,average_query_time_total,levenshteinThreshold,ratioThreshold
6,3000,Exact Covers via Determinants.,2185834287,conf/stacs/Bjorklund10,"(8, '-', 9)",129762.29471158981,Match,0.006693124771118164,0.01143789291381836,0.018572330474853516,0.4,0.85
6,3000,A new framework for characterization of halftone textures.,2101166552,conf/icassp/ChangA05,"(27, '-', 8)",129762.29471158981,Match,0.007673978805541992,0.013453483581542969,0.02168440818786621,0.4,0.85
6,3000,Message from the program committee chairs.,2185839301,conf/coolchips/IkedaA14,"(28, '-', 24)",129762.29471158981,Match,0.02047133445739746,0.025315046310424805,0.04672598838806152,0.4,0.85
6,3000,On-line routing and wavelength assignment for dynamic traffic in WDM ring and torus networks.,2101178150,conf/infocom/SaengudomlertMG03,"(49, '-', 21)",129762.29471158981,Match,0.01880621910095215,0.028319835662841797,0.04819011688232422,0.4,0.85
6,3000,A new class of Bent functions in Polynomial Forms.,2395385318,journals/iacr/Mesnager08,"(16, '-', 24)",129762.29471158981,Match,0.02014470100402832,0.023087263107299805,0.04409170150756836,0.4,0.85
6,3000,Function computation via subspace coding.,2101180384,conf/isit/KaramchandaniKFF10,"(18, '-', 10)",129762.29471158981,Match,0.01085042953491211,0.013732433319091797,0.02524399757385254,0.4,0.85
6,3000,A simpler load-balancing algorithm for range-partitioned data in peer-to-peer systems.,2101188642,journals/networks/ChawachatF15,"(41, '-', 15)",129762.29471158981,Match,0.03066539764404297,0.03921198844909668,0.07133340835571289,0.4,0.85
6,3000,Tuning Manifold Harmonics Filters.,2101190121,conf/sibgrapi/LewinerVBCMPCLANBPLMPM10,"(9, '-', 11)",129762.29471158981,Match,0.012851476669311523,0.0187990665435791,0.03236198425292969,0.4,0.85
6,3000,HMM training based on quality measurement.,2101191963,conf/icassp/GaoJPP99,"(18, '-', 12)",129762.29471158981,Match,0.014438867568969727,0.017812013626098633,0.03294110298156738,0.4,0.85
6,3000,A modified bat algorithm to predict Protein-Protein Interaction network.,2101198317,conf/cec/ChowdhuryRKN14,"(30, '-', 30)",129762.29471158981,Match,0.02234172821044922,0.025252580642700195,0.04851865768432617,0.4,0.85
6,3000,Analysis of envelope signal injection for improvement of RF amplifier intermodulation distortion.,2101201676,conf/cicc/LeungDGL04,"(57, '-', 14)",129762.29471158981,Match,0.037346601486206055,0.04801225662231445,0.08712291717529297,0.4,0.85
6,3000,Trees in tournaments.,2101203255,journals/combinatorica/HaggkvistT91,"(12, '-', 12)",129762.29471158981,Match,0.0011360645294189453,0.0010647773742675781,0.0022580623626708984,0.4,0.85
6,3000,News from the national science foundation.,2101204530,journals/comsur/Tekinay08b,"(25, '-', 25)",129762.29471158981,Match,0.017509937286376953,0.02034139633178711,0.03863191604614258,0.4,0.85
6,3000,Symbolic-numeric sparse interpolation of multivariate polynomials.,2101210801,conf/issac/GiesbrechtLL06,"(44, '-', 35)",129762.29471158981,Match,0.039354562759399414,0.03653740882873535,0.07722783088684082,0.4,0.85
6,3000,State of the journal.,2185870089,journals/ijmir/Lew16a,"(10, '-', 10)",129762.29471158981,Match,0.004575014114379883,0.0061817169189453125,0.010997533798217773,0.4,0.85
6,3000,Food for thought: designing for critical reflection on food practices.,2185871259,conf/ACMdis/ChoiLCM12,"(34, '-', 11)",129762.29471158981,Match,0.015677690505981445,0.02228093147277832,0.038810014724731445,0.4,0.85
6,3000,Motivated learning agent model for distributed collaborative systems.,2101213076,conf/cscwd/WangWW09,"(33, '-', 12)",129762.29471158981,Match,0.0202939510345459,0.030588150024414062,0.05201840400695801,0.4,0.85
6,3000,Stochastic and syntactic techniques for predicting phrase breaks.,2395405280,conf/interspeech/ReadC05,"(36, '-', 10)",129762.29471158981,Match,0.019071578979492188,0.03118586540222168,0.051427364349365234,0.4,0.85
6,3000,CoSMoS special issue editorial.,2395409826,journals/nc/StepneyA15,"(14, '-', 14)",129762.29471158981,Match,0.006012916564941406,0.00874018669128418,0.015105009078979492,0.4,0.85
6,3000,Interference mitigation using transmitter filters in CDMA systems.,2185879420,conf/pimrc/Choi02,"(26, '-', 10)",129762.29471158981,Match,0.016512155532836914,0.025005817413330078,0.042489051818847656,0.4,0.85
6,3000,Foreword from the Guest Editors.,2395418141,journals/algorithmica/MagniezN09,"(12, '-', 17)",129762.29471158981,Match,0.011713981628417969,0.009365320205688477,0.021533727645874023,0.4,0.85
6,3000,Managing requirements@run.time with a linguistic decision making approach.,2395424710,conf/wer/TorresA14,"(37, '-', 20)",129762.29471158981,Match,0.022115468978881836,0.02720808982849121,0.05034756660461426,0.4,0.85
6,3000,Stereo vision correspondence using a multichannel graph matching technique.,2101248374,conf/icra/NasrabadiLC88,"(50, '-', 14)",129762.29471158981,Match,0.022510051727294922,0.0340273380279541,0.057813167572021484,0.4,0.85
6,3000,Secure cell relay routing protocol for sensor networks.,2101248501,conf/ipccc/DuL05b,"(34, '-', 20)",129762.29471158981,Match,0.01984548568725586,0.023335933685302734,0.04404449462890625,0.4,0.85
6,3000,Superlinear lower bounds for multipass graph processing.,2395429576,journals/eccc/GuruswamiO13,"(36, '-', 14)",129762.29471158981,Match,0.015124082565307617,0.02192831039428711,0.03789520263671875,0.4,0.85
6,3000,Lislex: Legal issues of concern to the library and information sector.,2101267195,journals/jis/Oppenheim93b,"(40, '-', 40)",129762.29471158981,Match,0.018851518630981445,0.03165411949157715,0.0516963005065918,0.4,0.85
6,3000,Message from the technical program chairs.,2185915765,conf/iscc/BiazB08,"(18, '-', 18)",129762.29471158981,Match,0.01770162582397461,0.02324962615966797,0.04186749458312988,0.4,0.85
6,3000,Broadcast control of multi-agent systems.,2101268512,conf/cdc/AzumaYS11,"(17, '-', 14)",129762.29471158981,Match,0.011123418807983398,0.013173818588256836,0.02481818199157715,0.4,0.85
6,3000,Proof theory for lattice-ordered groups.,2395445860,conf/tacl/Metcalfe13,"(24, '-', 16)",129762.29471158981,Match,0.01270604133605957,0.019626379013061523,0.03307223320007324,0.4,0.85
6,3000,Performance and distance spectrum of space-time codes in fast Rayleigh fading channels.,2101285344,conf/wcnc/ByunPL03,"(50, '-', 22)",129762.29471158981,Match,0.03081822395324707,0.041811466217041016,0.07428956031799316,0.4,0.85
6,3000,Synthese optimaler Synchronisationsalgorithmen f&uuml;r additiv verrauschte Bitstr&ouml;me im Videoband II.,2395446820,journals/eik/AhlbehrendtK81a,"(45, '-', 8)",129762.29471158981,Match,0.009916305541992188,0.0183868408203125,0.029038667678833008,0.4,0.85
6,3000,Design and analysis of a denial-of-service-resistant quality-of-service signaling protocol for MANETs.,2101290139,journals/tvt/HejmoMZT06,"(42, '-', 30)",129762.29471158981,Match,0.04076051712036133,0.04886341094970703,0.09142565727233887,0.4,0.85
6,3000,Inventory Policies in a Decentralized Assembly System.,2101296357,journals/ior/BernsteinD06,"(15, '-', 23)",129762.29471158981,Match,0.018640756607055664,0.01775956153869629,0.0370945930480957,0.4,0.85
6,3000,Spanning closed walks and TSP in 3-connected planar graphs.,2101299686,conf/soda/KawarabayashiO12,"(32, '-', 15)",129762.29471158981,Match,0.015239953994750977,0.02410602569580078,0.040267229080200195,0.4,0.85
6,3000,Lossless compression of medical images.,2101300314,conf/cbms/Tavakoli91,"(20, '-', 13)",129762.29471158981,Match,0.011625528335571289,0.016811609268188477,0.0290834903717041,0.4,0.85
6,3000,An interactive graphic and process controlled system for composing and sampling loom constrained designs.,2101308986,conf/dac/DoonerVL73,"(49, '-', 8)",129762.29471158981,Match,0.026710987091064453,0.04100489616394043,0.06922411918640137,0.4,0.85
6,3000,Tactile array sensor for object identification using complex moments.,2101312007,conf/icra/LuoL87,"(38, '-', 10)",129762.29471158981,Match,0.016978025436401367,0.028283357620239258,0.046339988708496094,0.4,0.85
6,3000,Ultra wideband signal impact on IEEE802.11b and Bluetooth performances.,2101315174,conf/pimrc/HamalainenSMOP03,"(35, '-', 11)",129762.29471158981,Match,0.015433311462402344,0.017618179321289062,0.03379702568054199,0.4,0.85
6,3000,A 2018 workshop: vaccine and drug ontology studies (VDOS 2018).,2101341879,journals/bmcbi/HurTH19,"(30, '-', 10)",129762.29471158981,Match,0.010197877883911133,0.014687538146972656,0.02545642852783203,0.4,0.85
6,3000,Electronic data interchange.,2101341954,journals/clsr/Castell91,"(14, '-', 14)",129762.29471158981,Match,0.006984233856201172,0.013112306594848633,0.020630836486816406,0.4,0.85
6,3000,Embedded multiple description scalar quantizers for progressive image transmission.,2185980631,conf/icmcs/GavrilescuMSC03,"(43, '-', 24)",129762.29471158981,Match,0.029363393783569336,0.0434727668762207,0.07443833351135254,0.4,0.85
6,3000,Group-oriented Encryption Secure against Collude Attack.,2395486083,journals/jcit/MaA08,"(14, '-', 20)",129762.29471158981,Match,0.01971578598022461,0.0217130184173584,0.042276620864868164,0.4,0.85
6,3000,UbiMI: ubiquitous mobile instrumentation.,2101357892,conf/huc/FerreiraMHLK12,"(23, '-', 12)",129762.29471158981,Match,0.01003885269165039,0.01042485237121582,0.020870208740234375,0.4,0.85
6,3000,Locally Decodable Codes with 2 queries and Polynomial Identity Testing for depth 3 circuits,2395494586,journals/eccc/ECCC-TR05-044,"(41, '-', 21)",129762.29471158981,Match,0.03975844383239746,0.05623126029968262,0.0980997085571289,0.4,0.85
6,3000,Optimal control of systems with delayed observation sharing patterns via input-output methods.,2101373497,conf/cdc/Voulgaris00,"(49, '-', 12)",129762.29471158981,Match,0.0224606990814209,0.0343019962310791,0.05804777145385742,0.4,0.85
6,3000,COPERM: transform-domain energy compaction by optimal permutation.,2101377280,conf/icassp/SidiropoulosPBH98,"(31, '-', 13)",129762.29471158981,Match,0.01701641082763672,0.027225255966186523,0.045276641845703125,0.4,0.85
6,3000,Consistency of D-estimators.,2395501256,journals/kybernetika/Vajda84a,"(11, '-', 11)",129762.29471158981,Match,0.01967644691467285,0.023052692413330078,0.04360556602478027,0.4,0.85
6,3000,Clique-width of partner-limited graphs.,2101392634,journals/dm/Vanherpe04,"(19, '-', 8)",129762.29471158981,Match,0.009387731552124023,0.015380382537841797,0.025388717651367188,0.4,0.85
6,3000,Building expert systems.,2186018900,books/lib/Hayes-Roth83,"(11, '-', 10)",129762.29471158981,Match,0.004785060882568359,0.008421659469604492,0.013539791107177734,0.4,0.85
6,3000,Contingent information systems development.,2101399447,journals/jss/SlootenS96,"(18, '-', 10)",129762.29471158981,Match,0.011582612991333008,0.016047239303588867,0.028258562088012695,0.4,0.85
6,3000,$&#967;$-bounded families of oriented graphs.,2395512306,journals/corr/AboulkerBBCHMZ16,"(24, '-', 17)",129762.29471158981,Match,0.011391639709472656,0.01668572425842285,0.028740644454956055,0.4,0.85
6,3000,Premonoidal Categories and Notions of Computation.,2101416179,journals/mscs/PowerR97,"(14, '-', 23)",129762.29471158981,Match,0.014650821685791016,0.02202320098876953,0.037545204162597656,0.4,0.85
6,3000,Detection of apnoeic and breathing activity through pole-zero analysis of the SpO<sub>2</sub> signal.,2101418196,conf/embc/LazareckT06a,"(39, '-', 10)",129762.29471158981,Match,0.011388778686523438,0.019788026809692383,0.0319218635559082,0.4,0.85
6,3000,Specificity for interval-valued fuzzy sets.,2101420727,conf/fuzzIEEE/CampoGY10,"(24, '-', 19)",129762.29471158981,Match,0.018462181091308594,0.025055408477783203,0.04443168640136719,0.4,0.85
6,3000,MLSE equalization and decoding for multipath-fading channels.,2101421262,journals/tcom/SheenS91,"(25, '-', 20)",129762.29471158981,Match,0.021970510482788086,0.032944440841674805,0.056139469146728516,0.4,0.85
6,3000,Fractionally-addressed delay lines,2101421926,journals/corr/cs-SD-0005022,"(18, '-', 8)",129762.29471158981,Match,0.008772611618041992,0.010698080062866211,0.01999187469482422,0.4,0.85
6,3000,The Unexpected Dangers of Dynamic JavaScript.,2101424852,conf/uss/LekiesSWJ15,"(9, '-', 9)",129762.29471158981,Match,0.0083160400390625,0.014180660247802734,0.02306365966796875,0.4,0.85
6,3000,Update of AMmtDB: a database of multi-aligned Metazoa mitochondrial DNA sequences.,2101427594,journals/nar/LanaveLLA00,"(35, '-', 35)",129762.29471158981,Match,0.015877485275268555,0.024131059646606445,0.0409393310546875,0.4,0.85
6,3000,Nash equilibrium and robust stability in dynamic games: A small-gain perspective.,2101428844,conf/cdc/KarafyllisJA10,"(43, '-', 18)",129762.29471158981,Match,0.018975257873535156,0.024508237838745117,0.044507741928100586,0.4,0.85
6,3000,Optimal lower bounds for locality sensitive hashing (except when q is tiny).,2395529543,journals/eccc/ODonnellWZ09,"(53, '-', 53)",129762.29471158981,Match,0.019130468368530273,0.029494524002075195,0.049715280532836914,0.4,0.85
6,3000,GaussBits: magnetic tangible bits for portable and occlusion-free near-surface interactions.,2101431445,conf/chi/LiangCCPCLYC13,"(49, '-', 15)",129762.29471158981,Match,0.02621626853942871,0.038832664489746094,0.06652951240539551,0.4,0.85
6,3000,Risikomanagement in IT-Projekten.,2395532391,conf/swm/Gaulke02,"(9, '-', 6)",129762.29471158981,Match,0.003244161605834961,0.006692409515380859,0.010190248489379883,0.4,0.85
6,3000,The impact of higher-order state and control effects on local relational reasoning.,2101443478,conf/icfp/DreyerNB10,"(48, '-', 14)",129762.29471158981,Match,0.03028249740600586,0.043494224548339844,0.07538175582885742,0.4,0.85
6,3000,Linearly Homomorphic Signatures over Binary Fields and New Tools for Lattice-Based Signatures.,2101444129,conf/pkc/BonehF11,"(32, '-', 29)",129762.29471158981,Match,0.03979158401489258,0.04474282264709473,0.08620905876159668,0.4,0.85
6,3000,Parametric architecture for implementing multimedia algorithms.,2101451110,conf/icdsp/KavvadiasN02,"(30, '-', 11)",129762.29471158981,Match,0.03460383415222168,0.03731036186218262,0.07330155372619629,0.4,0.85
6,3000,Stand der Technik.,2186059201,journals/dud/Knopp17,"(5, '-', 5)",129762.29471158981,Match,0.003377199172973633,0.0069048404693603516,0.010564804077148438,0.4,0.85
6,3000,Local stabilization of linear systems under amplitude and rate saturating actuators.,2101451612,conf/cdc/SilvaT00,"(57, '-', 35)",129762.29471158981,Match,0.026491403579711914,0.03696584701538086,0.06480884552001953,0.4,0.85
6,3000,Interfacing Synchronous and Asynchronous Modules Within a High-Speed Pipeline.,2101456474,conf/arvlsi/SjogrenM97,"(32, '-', 32)",129762.29471158981,Match,0.03611111640930176,0.031162023544311523,0.0684206485748291,0.4,0.85
6,3000,Approximating Shortest Superstrings,2101468281,conf/focs/TengY93,"(11, '-', 12)",129762.29471158981,Match,0.009587287902832031,0.013742446899414062,0.023909568786621094,0.4,0.85
6,3000,Jena: implementing the semantic web recommendations.,2101491706,conf/www/CarrollDDRSW04,"(21, '-', 10)",129762.29471158981,Match,0.012886524200439453,0.017145633697509766,0.030697345733642578,0.4,0.85
6,3000,Two-stage neural network for volume segmentation of medical images.,2101494031,conf/icnn/AhmedF97,"(29, '-', 14)",129762.29471158981,Match,0.014738798141479492,0.022062301635742188,0.03763127326965332,0.4,0.85
6,3000,Fixed point theorems for fuzzy mappings.,2186094905,journals/fss/VijayarajuM03,"(20, '-', 17)",129762.29471158981,Match,0.013112545013427734,0.019289255142211914,0.03313589096069336,0.4,0.85
6,3000,Corrigendum: Public-key encryption indistinguishable under plaintext-checkable attacks.,2186096729,journals/iet-ifs/AbdallaBP20,"(48, '-', 22)",129762.29471158981,Match,0.019526243209838867,0.02597975730895996,0.04649710655212402,0.4,0.85
6,3000,Sensory-based motion planning with global proofs.,2101502731,journals/trob/KamonR97,"(24, '-', 12)",129762.29471158981,Match,0.012593984603881836,0.021792888641357422,0.035233497619628906,0.4,0.85
6,3000,Viability of in-house datamarting approaches for population genetics analysis of SNP genotypes.,2101510809,journals/bmcbi/AmigoPSC09,"(44, '-', 19)",129762.29471158981,Match,0.02390742301940918,0.036019086837768555,0.06132245063781738,0.4,0.85
6,3000,Securing RDS broadcast messages for smart grid applications.,2101511734,conf/iwcmc/KgwadiK10,"(33, '-', 14)",129762.29471158981,Match,0.015477180480957031,0.020776033401489258,0.03702569007873535,0.4,0.85
6,3000,Data Recovery from Distributed Personal Repositories.,2101522571,conf/ercimdl/MayerNR09,"(12, '-', 13)",129762.29471158981,Match,0.017418861389160156,0.026315689086914062,0.044721364974975586,0.4,0.85
6,3000,On a problem of R. Halin concerning infinite graphs II.,2101523490,journals/dm/Andreae80,"(27, '-', 12)",129762.29471158981,Match,0.012111425399780273,0.017132282257080078,0.03001713752746582,0.4,0.85
6,3000,Teaching software project management using simulations.,2101533523,conf/csee/BollinHM11,"(29, '-', 15)",129762.29471158981,Match,0.017826318740844727,0.02397751808166504,0.04269099235534668,0.4,0.85
6,3000,On the horizons in constrained linear quadratic regulation.,2101537236,conf/cdc/ZhaoL07,"(38, '-', 19)",129762.29471158981,Match,0.01854085922241211,0.026190757751464844,0.04573535919189453,0.4,0.85
6,3000,A polyhedral study of the maximum edge subgraph problem.,2101537986,journals/dam/BonomoMSM12,"(39, '-', 16)",129762.29471158981,Match,0.015516996383666992,0.02423262596130371,0.04068589210510254,0.4,0.85
6,3000,Hybrid aerial and scansorial robotics.,2101560264,conf/icra/DesbiensAC10,"(25, '-', 9)",129762.29471158981,Match,0.009501457214355469,0.017947912216186523,0.028133869171142578,0.4,0.85
6,3000,Toward A Normative Theory of Normative Marketing Theory,2101563413,journals/corr/abs-1205-5821,"(15, '-', 25)",129762.29471158981,Match,0.0201570987701416,0.02722954750061035,0.04841923713684082,0.4,0.85
6,3000,Unambiguous 1-Uniform Morphisms,2395606988,journals/corr/abs-1108-3633,"(12, '-', 11)",129762.29471158981,Match,0.007034778594970703,0.007487297058105469,0.014888286590576172,0.4,0.85
6,3000,On the maximal connected component of hypercube with faulty vertices (II).,2101573191,journals/ijcm/YangEM04,"(52, '-', 48)",129762.29471158981,Match,0.02109050750732422,0.032206058502197266,0.05449342727661133,0.4,0.85
6,3000,Diagonal stability of stochastic systems subject to nonlinear disturbances and diagonal H<sub>2</sub> norms.,2101578135,journals/automatica/LangbortU11,"(67, '-', 26)",129762.29471158981,Match,0.031568050384521484,0.03744983673095703,0.07039237022399902,0.4,0.85
6,3000,Time-domain performance based non-linear state feedback control of constrained linear systems.,2101584772,journals/ijcon/AangenentJMS09,"(47, '-', 18)",129762.29471158981,Match,0.025106430053710938,0.034116506576538086,0.0604863166809082,0.4,0.85
6,3000,Planar Hypohamiltonian Graphs on 40 Vertices,2101585347,journals/corr/abs-1302-2698,"(19, '-', 19)",129762.29471158981,Match,0.006996631622314453,0.010426998138427734,0.017853975296020508,0.4,0.85
6,3000,Analysis and generalization of Retinex by recasting the algorithm in wavelets.,2101586809,conf/hvei/Rising02,"(32, '-', 8)",129762.29471158981,Match,0.015841245651245117,0.025011062622070312,0.04179525375366211,0.4,0.85
6,3000,The distribution of calibrated likelihood-ratios in speaker recognition.,2101587318,conf/interspeech/LeeuwenB13,"(43, '-', 17)",129762.29471158981,Match,0.023973464965820312,0.02693772315979004,0.051961421966552734,0.4,0.85
6,3000,"Comments on ""Output feedback stabilization for uncertain systems: constrained Riccati approach"".",2101592222,journals/tac/Kim01a,"(39, '-', 21)",129762.29471158981,Match,0.027162790298461914,0.03925299644470215,0.06787610054016113,0.4,0.85
6,3000,Partial fillup and search time in LC tries.,2101596348,journals/talg/JansonS07,"(24, '-', 7)",129762.29471158981,Match,0.006634950637817383,0.012636899948120117,0.019784212112426758,0.4,0.85
6,3000,Comparing heuristic search methods and genetic algorithms for warehouse scheduling.,2101605557,conf/smc/WhitleyHRWB98,"(48, '-', 13)",129762.29471158981,Match,0.023961544036865234,0.029306411743164062,0.054383039474487305,0.4,0.85
6,3000,A parallel and efficient approach to large scale clone detection.,2101606071,conf/iwsc/SajnaniL13,"(35, '-', 12)",129762.29471158981,Match,0.014120101928710938,0.023818254470825195,0.0388646125793457,0.4,0.85
6,3000,Data management projects at Google.,2101610060,conf/sigmod/HsiehMP06,"(16, '-', 9)",129762.29471158981,Match,0.009651899337768555,0.014801025390625,0.025027990341186523,0.4,0.85
6,3000,More efficient periodic traversal in anonymous undirected graphs.,2101611980,journals/tcs/CzyzowiczDGIJKLMSS12,"(50, '-', 17)",129762.29471158981,Match,0.02144598960876465,0.03141522407531738,0.05405592918395996,0.4,0.85
6,3000,The Mathematics of Obscurity: On the Trustworthiness of Open Source.,2395632715,conf/weis/HartigHR10,"(17, '-', 18)",129762.29471158981,Match,0.01959228515625,0.025908231735229492,0.046459197998046875,0.4,0.85
6,3000,On-line adaptation of hidden Markov models using incremental estimation algorithms.,2395633278,conf/interspeech/Digalakis97,"(38, '-', 14)",129762.29471158981,Match,0.02802586555480957,0.03831911087036133,0.06777524948120117,0.4,0.85
6,3000,Energy Neutral Clustering for energy harvesting wireless sensors networks.,2101615289,conf/icon/PengL13,"(29, '-', 36)",129762.29471158981,Match,0.02507305145263672,0.029480695724487305,0.055666446685791016,0.4,0.85
6,3000,Transparent robust information hiding for ownership verification.,2101626359,conf/icassp/YuSR04,"(40, '-', 16)",129762.29471158981,Match,0.01523733139038086,0.023729562759399414,0.03988194465637207,0.4,0.85
6,3000,Adaptive control of mixed rigid/flexible joint robot manipulators based on virtual decomposition.,2101630027,conf/icra/ZhuS97,"(51, '-', 16)",129762.29471158981,Match,0.018162012100219727,0.02799820899963379,0.04719185829162598,0.4,0.85
6,3000,"Comments on ""analysis of cognitive radio spectrum access with optimal channel reservation"".",2101640072,journals/icl/Martinez-BausetPP09,"(45, '-', 20)",129762.29471158981,Match,0.02151942253112793,0.028668642044067383,0.05128645896911621,0.4,0.85
6,3000,Changing of the guard.,2101650815,journals/lp/Luther16a,"(10, '-', 9)",129762.29471158981,Match,0.0040874481201171875,0.0066585540771484375,0.011013984680175781,0.4,0.85
6,3000,Medical image processing.,2395655551,journals/isci/ChengW05,"(8, '-', 9)",129762.29471158981,Match,0.003782987594604492,0.005061626434326172,0.009048938751220703,0.4,0.85
6,3000,Big data integration.,2101654853,conf/icde/DongS13,"(8, '-', 9)",129762.29471158981,Match,0.007381439208984375,0.010034322738647461,0.01781177520751953,0.4,0.85
6,3000,On performance analysis and design criteria for trellis coded unitary space-time modulation.,2101656383,conf/wcnc/SunT03,"(55, '-', 22)",129762.29471158981,Match,0.030362606048583984,0.04340076446533203,0.0753791332244873,0.4,0.85
6,3000,Small PCPs with low query complexity.,2395658984,journals/cc/HarshaS00,"(15, '-', 7)",129762.29471158981,Match,0.0038661956787109375,0.007515430450439453,0.011673450469970703,0.4,0.85
6,3000,Designing seeds for similarity search in genomic DNA.,2101664494,conf/recomb/BuhlerKS03,"(31, '-', 10)",129762.29471158981,Match,0.015292882919311523,0.023027658462524414,0.03920149803161621,0.4,0.85
6,3000,Video compression techniques.,2186226531,books/daglib/0094457,"(11, '-', 9)",129762.29471158981,Match,0.007723808288574219,0.011701345443725586,0.019876956939697266,0.4,0.85
6,3000,Tracking Pedestrians Using Local Spatio-Temporal Motion Patterns in Extremely Crowded Scenes.,2101668106,journals/pami/KratzN12,"(15, '-', 38)",129762.29471158981,Match,0.02637314796447754,0.03914284706115723,0.0669393539428711,0.4,0.85
6,3000,Decomposition techniques for temporal resource allocation.,2101678858,conf/cdc/WuC04a,"(23, '-', 12)",129762.29471158981,Match,0.016370534896850586,0.021822690963745117,0.039034128189086914,0.4,0.85
6,3000,Characterizing polynomials with roots in a semi-algebraic set.,2101683881,conf/cdc/Lasserre03,"(36, '-', 17)",129762.29471158981,Match,0.018690824508666992,0.019817113876342773,0.03929495811462402,0.4,0.85
6,3000,An asymptotic preserving unified gas kinetic particle method for radiative transfer equations.,2101689071,journals/jcphy/ShiSS20,"(48, '-', 38)",129762.29471158981,Match,0.023259639739990234,0.031919240951538086,0.05640363693237305,0.4,0.85
6,3000,Message from the program committee chairs.,2186244034,conf/coolchips/IkedaA14,"(29, '-', 25)",129762.29471158981,Match,0.021725893020629883,0.024128437042236328,0.04677939414978027,0.4,0.85
6,3000,The similarity metric.,2101694047,journals/tit/LiCLMV04,"(9, '-', 9)",129762.29471158981,Match,0.0021474361419677734,0.0028371810913085938,0.005122661590576172,0.4,0.85
6,3000,Cancer gene prioritization by integrative analysis of mRNA expression and DNA copy number data: a comparative review.,2101695910,journals/bib/LahtiSKBD13,"(55, '-', 16)",129762.29471158981,Match,0.040039777755737305,0.05897164344787598,0.10138154029846191,0.4,0.85
6,3000,Adaptive detection of transient signals.,2186257589,conf/icassp/PoratF85,"(18, '-', 14)",129762.29471158981,Match,0.009959220886230469,0.013628721237182617,0.02417302131652832,0.4,0.85
6,3000,Finding the Maximum Area Parallelogram in a Convex Polygon.,2186258632,conf/cccg/JinM11,"(14, '-', 16)",129762.29471158981,Match,0.015692949295043945,0.025603532791137695,0.042281150817871094,0.4,0.85
6,3000,Acknowledgment of JAISE reviewers.,2101719524,journals/jaise/AghajanAPM17,"(12, '-', 12)",129762.29471158981,Match,0.006644248962402344,0.010391473770141602,0.017445087432861328,0.4,0.85
